doi,halId,hal_coverage,upw_coverage,title,hal_docType,hal_location,hal_openAccess_bool,hal_submittedDate,hal_licence,hal_selfArchiving,hal_domain,hal_shsdomain,hal_infodomain,published_date,published_year,journal_name,journal_issns,publisher,genre,journal_issn_l,oa_status,upw_location,version,suspicious_journal,licence,journal_is_in_doaj,journal_is_oa,author_count,is_paratext,apc_tracking,apc_amount,apc_currency,is_oa,oa_type,scientific_field,shs_field,info_field
10.1002/9781119341031.ch3,hal-01944915,in,closed,Complexity and Scientific Challenges,COUV,notice,False,2018-12-05 04:27:20,,True,['0.info'],[],['1.info.info-hc'],2018-03-25,2018,Virtual Reality and Augmented Reality,False,"John Wiley & Sons, Inc.",Chapitres d'ouvrage,,closed,,,False,,,,13.0,,,,,False,closed,['Informatique'],[],['Interface homme-machine']
10.1002/9781119341031.ch4,hal-01735022,in,closed,Towards VE that are More Closely Related to the Real World,COUV,notice,False,2018-03-15 13:14:40,,True,['0.info'],[],"['1.info.info-hc', '1.info.info-gr']",2018-03-25,2018,Virtual Reality and Augmented Reality,False,"John Wiley & Sons, Inc.",Chapitres d'ouvrage,,closed,,,False,,,,6.0,,,,,False,closed,['Informatique'],[],"['Interface homme-machine', ""Synthèse d'image et réalité virtuelle""]"
10.1002/9781119341031.ch5,hal-01946504,in,closed,Scientific and Technical Prospects,COUV,notice,False,2018-12-06 10:16:12,,True,['0.info'],[],"['1.info.info-bt', '1.info.info-hc', '1.info.info-lg', '1.info.info-gr']",2018-03-25,2018,Virtual Reality and Augmented Reality,False,"John Wiley & Sons, Inc.",Chapitres d'ouvrage,,closed,,,False,,,,7.0,,,,,False,closed,['Informatique'],[],"['Autres', 'Interface homme-machine', 'Autres', ""Synthèse d'image et réalité virtuelle""]"
10.1002/jsid.752,hal-01987255,in,oa,A study on differences in human perception between a real and an AR scene viewed in an OST-HMD,ART,file,True,2019-01-21 08:27:47,,True,['0.info'],[],['1.info.info-gr'],2019-01-20,2019,Journal of the Society for Information Display,1071-0922,Wiley,Articles dans une revue,1071-0922,green,repository,publishedVersion,False,,,,6.0,,,,,True,repository,['Informatique'],[],"[""Synthèse d'image et réalité virtuelle""]"
10.1002/jsid.832,hal-02200576,in,oa,Influence of virtual objects' shadows and lighting coherence on distance perception in optical see‐through augmented reality,ART,file,True,2019-12-16 15:48:35,,True,['0.info'],[],['1.info.info-gr'],2019-07-30,2019,Journal of the Society for Information Display,"1071-0922,1938-3657",Wiley,Articles dans une revue,1071-0922,green,repository,submittedVersion,False,,,,6.0,,,,,True,repository,['Informatique'],[],"[""Synthèse d'image et réalité virtuelle""]"
10.1002/navi.254,hal-01896361,in,closed,"Fusion of 3D GIS, Vision, Inertial and Magnetic Data for Improved Urban Pedestrian Navigation and Augmented Reality Applications",ART,notice,False,2018-10-16 09:53:21,,False,['0.spi'],[],[],2018-09-01,2018,Navigation,0028-1522,Wiley,Articles dans une revue,0028-1522,closed,,,False,,,,3.0,,,,,False,closed,"[""Sciences de l'ingénieur""]",[],[]
10.1007/1-84628-048-6_7,hal-01555279,in,oa,Acoustic diffraction patterns from fractal to urban structures: applications to the Sierpinski triangle and to a neoclassical urban facade,COUV,file,True,2017-07-03 22:07:35,,True,"['0.math', '0.spi']",[],[],2005,2005,Fractals in Engineering,False,Springer-Verlag,Chapitres d'ouvrage,,green,repository,submittedVersion,False,,,,1.0,,,,,True,repository,"['Autres', ""Sciences de l'ingénieur""]",[],[]
10.1007/978-3-030-01790-3_12,hal-01947356,in,oa,Evaluation of AR Inconsistencies on AR Placement Tasks: A VR Simulation Study,COMM,file,True,2018-12-06 16:45:13,,True,['0.info'],[],"['1.info.info-gr', '1.info.info-hc']",2018-01-01,2018,Lecture Notes in Computer Science,"0302-9743,1611-3349",Springer International Publishing,Communications dans un congrès,0302-9743,green,repository,submittedVersion,False,,,,4.0,,,,,True,repository,['Informatique'],[],"[""Synthèse d'image et réalité virtuelle"", 'Interface homme-machine']"
10.1007/978-3-030-76694-8,halshs-03329497,in,closed,Experiential Walks for Urban Design,DOUV,notice,False,2021-08-31 09:09:49,,True,['0.shs'],['1.shs.archi'],[],2021-01-01,2021,Springer Tracts in Civil Engineering,"2366-259X,2366-2603",Springer International Publishing,Direction d'ouvrages,2366-2603,closed,,,False,,,,3.0,,,,,False,closed,"[""Sciences de l'Homme et de la Société""]","[""Architecture, aménagement de l'espace""]",[]
10.1007/978-3-030-76694-8_12,halshs-03329818,in,closed,Capturing Chromatic Effects in Urban Environment,COUV,notice,False,2021-08-31 12:02:20,,True,['0.shs'],['1.shs.archi'],[],2021-01-01,2021,Springer Tracts in Civil Engineering,"2366-259X,2366-2603",Springer International Publishing,Chapitres d'ouvrage,2366-2603,closed,,,False,,,,3.0,,,,,False,closed,"[""Sciences de l'Homme et de la Société""]","[""Architecture, aménagement de l'espace""]",[]
10.1007/978-3-319-51804-6,halshs-01541102,in,oa,Urban Design and Representation,COUV,notice,True,2017-06-17 15:35:44,,True,['0.shs'],['1.shs.archi'],[],2017-01-01,2017,,False,Springer International Publishing,Chapitres d'ouvrage,,green,repository,submittedVersion,False,,,,3.0,,,,,True,repository,"[""Sciences de l'Homme et de la Société""]","[""Architecture, aménagement de l'espace""]",[]
10.1007/978-3-319-51804-6_6,hal-01491469,in,oa,Motion Perspectives Integration in the Qualification of the Urban Spaces: Towards a 2D- and a 3D-Enrichment of the S-Partition Method,COUV,file,True,2017-03-16 21:39:41,,True,"['0.info', '0.shs', '0.sde']",['1.shs.archi'],['1.info.info-mo'],2017-01-01,2017,Urban Design and Representation,False,Springer International Publishing,Chapitres d'ouvrage,,green,repository,submittedVersion,False,,,,3.0,,,,,True,repository,"['Informatique', ""Sciences de l'Homme et de la Société"", ""Sciences de l'environnement""]","[""Architecture, aménagement de l'espace""]",['Modélisation et simulation']
10.1007/978-3-642-10595-1_5,halshs-01092994,in,closed,TAnaTo2: A Tool to Evaluate the Impact of Natural and Anthropogenic Artefacts with a TIN-Based Model,COUV,notice,False,2014-12-09 21:38:08,,True,['0.shs'],['1.shs.geo'],[],2011-10-27,2011,Geospatial Free and Open Source Software in the 21st Century,"1863-2246,1863-2351",Springer Berlin Heidelberg,Chapitres d'ouvrage,1863-2246,closed,,,False,,,,2.0,,,,,False,closed,"[""Sciences de l'Homme et de la Société""]",['Géographie'],[]
10.1007/978-3-642-12326-9_13,hal-01347345,in,oa,Towards a Spatial Semantics to Analyze the Visual Dynamics of the Pedestrian Mobility in the Urban Fabric,COUV,file,True,2016-07-20 18:48:47,,True,"['0.info', '0.shs', '0.sde']",['1.shs.archi'],['1.info.info-mo'],2010-01-01,2010,Geospatial Thinking,"1863-2246,1863-2351",Springer Berlin Heidelberg,Chapitres d'ouvrage,1863-2246,green,repository,submittedVersion,False,,,,4.0,,,,,True,repository,"['Informatique', ""Sciences de l'Homme et de la Société"", ""Sciences de l'environnement""]","[""Architecture, aménagement de l'espace""]",['Modélisation et simulation']
10.1007/978-3-642-19766-6_11,hal-01347331,in,oa,Measuring Surrounding Space to Assess the Pedestrian Visual Aperture Angle in the Urban Fabric: Toward a Kurtosis-Based Isovist Indicator,COUV,file,True,2016-07-20 18:15:16,,True,"['0.info', '0.shs', '0.sde']",['1.shs.archi'],['1.info.info-mo'],2011-01-01,2011,Information Fusion and Geographic Information Systems,"1863-2246,1863-2351",Springer Berlin Heidelberg,Chapitres d'ouvrage,1863-2246,green,repository,submittedVersion,False,,,,4.0,,,,,True,repository,"['Informatique', ""Sciences de l'Homme et de la Société"", ""Sciences de l'environnement""]","[""Architecture, aménagement de l'espace""]",['Modélisation et simulation']
10.1007/978-3-642-19789-5_14,hal-01347341,in,oa,Towards a “typification” of the Pedestrian Surrounding Space: Analysis of the Isovist Using Digital processing Method,COUV,file,True,2016-07-25 14:17:19,,True,"['0.info', '0.shs', '0.sde']",['1.shs.archi'],['1.info.info-mo'],2011-01-01,2011,Advancing Geoinformation Science for a Changing World,"1863-2246,1863-2351",Springer Berlin Heidelberg,Chapitres d'ouvrage,1863-2246,green,repository,submittedVersion,False,,,,3.0,,,,,True,repository,"['Informatique', ""Sciences de l'Homme et de la Société"", ""Sciences de l'environnement""]","[""Architecture, aménagement de l'espace""]",['Modélisation et simulation']
10.1007/978-3-642-24574-9_35,hal-01521481,in,closed,Transforming Conceptual Spatiotemporal Model into Object Model with Semantic Keeping,COMM,notice,False,2017-05-11 18:08:25,,True,['0.info'],[],['1.info.info-mo'],2011-01-01,2011,Lecture Notes in Computer Science,"0302-9743,1611-3349",Springer Berlin Heidelberg,Communications dans un congrès,0302-9743,closed,,,False,,,,3.0,,,,,False,closed,['Informatique'],[],['Modélisation et simulation']
10.1007/978-3-642-29063-3_18,hal-01347299,in,oa,Towards Urban Fabrics Characterization Based on Buildings Footprints,COUV,file,True,2016-07-20 17:13:14,,True,"['0.info', '0.shs', '0.sde']",['1.shs.archi'],['1.info.info-mo'],2012-01-01,2012,Bridging the Geographic Information Sciences,"1863-2246,1863-2351",Springer Berlin Heidelberg,Chapitres d'ouvrage,1863-2246,green,repository,submittedVersion,False,,,,3.0,,,,,True,repository,"['Informatique', ""Sciences de l'Homme et de la Société"", ""Sciences de l'environnement""]","[""Architecture, aménagement de l'espace""]",['Modélisation et simulation']
10.1007/978-3-642-31833-7_16,hal-01347216,in,oa,A New Method to Characterize Density Adapted to a Coarse City Model,COUV,file,True,2016-07-20 15:55:10,,True,"['0.info', '0.shs', '0.sde']",['1.shs.archi'],['1.info.info-mo'],2013-12-05,2013,Information Fusion and Geographic Information Systems (IF AND GIS 2013),"1863-2246,1863-2351",Springer Berlin Heidelberg,Chapitres d'ouvrage,1863-2246,green,repository,submittedVersion,False,,,,3.0,,,,,True,repository,"['Informatique', ""Sciences de l'Homme et de la Société"", ""Sciences de l'environnement""]","[""Architecture, aménagement de l'espace""]",['Modélisation et simulation']
10.1007/978-3-642-39330-3_57,hal-00850386,in,oa,Design of a Visual Query Language for Geographic Information System on a Touch Screen,COMM,file,True,2014-01-06 12:12:58,,False,['0.info'],[],['1.info.info-hc'],2013-01-01,2013,Lecture Notes in Computer Science,"0302-9743,1611-3349",Springer Berlin Heidelberg,Communications dans un congrès,0302-9743,green,repository,submittedVersion,False,,,,4.0,,,,,True,repository,['Informatique'],[],['Interface homme-machine']
10.1007/978-3-658-11492-3_11,hal-02558010,in,closed,Die Bedeutung von Alltagsästhetik im Kontext der Polarisierung und Hybridisierung von Städten,COUV,notice,False,2020-04-29 10:46:48,,True,['0.shs'],"['1.shs.archi', '1.shs.geo']",[],2015-11-25,2015,Fraktale Metropolen,"2509-3789,2509-3797",Springer Fachmedien Wiesbaden,Chapitres d'ouvrage,2509-3797,closed,,,False,,,,1.0,,,,,False,closed,"[""Sciences de l'Homme et de la Société""]","[""Architecture, aménagement de l'espace"", 'Géographie']",[]
10.1007/978-3-658-24161-2_5,hal-02557991,in,closed,Für ein alltagsästhetisches Verständnis von Heimat,COUV,notice,False,2020-04-29 10:39:08,,True,['0.shs'],"['1.shs.archi', '1.shs.geo']",[],2019-01-01,2019,Heimat,"2625-6991,2625-7009",Springer Fachmedien Wiesbaden,Chapitres d'ouvrage,2625-7009,closed,,,False,,,,1.0,,,,,False,closed,"[""Sciences de l'Homme et de la Société""]","[""Architecture, aménagement de l'espace"", 'Géographie']",[]
10.1007/978-3-658-25746-0_35,hal-02557946,in,closed,Atmosphären und Landschaft,COUV,notice,False,2020-04-29 10:13:05,,True,['0.shs'],['1.shs.geo'],[],2019-01-01,2019,Handbuch Landschaft,"2625-6991,2625-7009",Springer Fachmedien Wiesbaden,Chapitres d'ouvrage,2625-7009,closed,,,False,,,,1.0,,,,,False,closed,"[""Sciences de l'Homme et de la Société""]",['Géographie'],[]
10.1007/978-3-7091-1251-9_6,hal-01501962,in,closed,"Concurrent Geometric, Structural and Environmental Design: Louvre Abu Dhabi",COUV,notice,False,2017-04-04 18:16:27,,True,"['0.info', '0.shs']",['1.shs.archi'],['1.info.info-mo'],2013-01-01,2013,Advances in Architectural Geometry 2012,False,Springer Vienna,Chapitres d'ouvrage,,closed,,,False,,,,6.0,,,,,False,closed,"['Informatique', ""Sciences de l'Homme et de la Société""]","[""Architecture, aménagement de l'espace""]",['Modélisation et simulation']
10.1007/978-94-007-2540-9_2,hal-01347313,in,oa,Environmental impact assessment of urban mobility plan: a methodology including socio-economic consequences,COUV,notice,True,2016-07-20 17:38:40,,True,['0.sde'],[],[],2011-12-10,2011,Alliance for Global Sustainability Bookseries,1571-4780,Springer Netherlands,Chapitres d'ouvrage,1571-4780,green,repository,submittedVersion,False,,,,28.0,,,,,True,repository,"[""Sciences de l'environnement""]",[],[]
10.1007/978-94-017-9136-6_7,hal-01521560,in,closed,Challenges of Image-Based Crowd-Sourcing for Situation Awareness in Disaster Management,COUV,notice,False,2017-05-11 21:49:24,,True,['0.info'],[],[],2014-01-01,2014,NATO Science for Peace and Security Series C: Environmental Security,"1874-6519,1874-6543",Springer Netherlands,Chapitres d'ouvrage,1874-6519,closed,,,False,,,,4.0,,,,,False,closed,['Informatique'],[],[]
10.1007/s10055-010-0173-7,hal-01521143,in,oa,Camera tracking by online learning of keypoint arrangements using LLAH in augmented reality applications,ART,file,True,2017-05-11 15:58:27,,True,['0.info'],[],['1.info.info-cv'],2010-10-07,2010,Virtual Reality,"1359-4338,1434-9957",Springer Science and Business Media LLC,Articles dans une revue,1359-4338,green,repository,submittedVersion,False,,,,4.0,,,,,True,repository,['Informatique'],[],['Vision par ordinateur et reconnaissance de formes']
10.1007/s10546-004-9241-4,hal-00111637,in,oa,The urban boundary-layer field campaign in marseille (ubl/clu-escompte): set-up and first results,ART,file,True,2021-05-21 21:59:30,http://creativecommons.org/licenses/by/,False,['0.phys'],[],[],2005-02-01,2005,Boundary-Layer Meteorology,"0006-8314,1573-1472",Springer Science and Business Media LLC,Articles dans une revue,0006-8314,green,repository,submittedVersion,False,cc-by,,,35.0,,,,,True,repository,['Autres'],[],[]
10.1007/s11069-014-1538-0,hal-01121491,in,closed,Seismic vulnerability assessment of urban environments in moderate-to-low seismic hazard regions using association rule learning and support vector machine methods,ART,notice,False,2015-03-01 20:04:17,,True,['0.sde'],[],[],2014-11-30,2014,Natural Hazards,"0921-030X,1573-0840",Springer Science and Business Media LLC,Articles dans une revue,0921-030X,closed,,,False,,,,6.0,,,,,False,closed,"[""Sciences de l'environnement""]",[],[]
10.1016/j.apacoust.2003.11.002,hal-01555290,in,oa,Prediction of the sound field into high-rise building facades due to its balcony ceiling form,ART,file,True,2017-07-03 22:50:10,,True,"['0.spi', '0.shs', '0.phys']",['1.shs.archi'],[],2004-04-01,2004,Applied Acoustics,0003-682X,Elsevier BV,Articles dans une revue,0003-682X,green,repository,publishedVersion,False,,,,2.0,,,,,True,repository,"[""Sciences de l'ingénieur"", ""Sciences de l'Homme et de la Société"", 'Autres']","[""Architecture, aménagement de l'espace""]",[]
10.1016/j.apacoust.2004.09.004,hal-01555283,in,oa,The acoustical influence of balcony depth and parapet form: experiments and simulations,ART,file,True,2017-07-03 22:30:00,,True,"['0.spi', '0.phys', '0.shs']",['1.shs.archi'],[],2005-05-01,2005,Applied Acoustics,0003-682X,Elsevier BV,Articles dans une revue,0003-682X,green,repository,submittedVersion,False,,,,2.0,,,,,True,repository,"[""Sciences de l'ingénieur"", 'Autres', ""Sciences de l'Homme et de la Société""]","[""Architecture, aménagement de l'espace""]",[]
10.1016/j.biosystemseng.2014.08.017,hal-01526013,in,closed,"CFD simulations of the night-time condensation inside a closed glasshouse: Sensitivity analysis to outside external conditions, heating and glass properties",ART,notice,False,2017-05-22 15:18:08,,False,['0.sdv'],[],[],2014-11-01,2014,Biosystems Engineering,1537-5110,Elsevier BV,Articles dans une revue,1537-5110,closed,,,False,,,,5.0,,,,,False,closed,['Autres'],[],[]
10.1016/j.buildenv.2009.11.011,hal-01145095,in,closed,An application of the thermo-radiative model SOLENE for the evaluation of street canyon energy balance,ART,notice,False,2015-04-23 14:44:29,,False,['0.phys'],[],[],2010-05-01,2010,Building and Environment,0360-1323,Elsevier BV,Articles dans une revue,0360-1323,closed,,,False,,,,5.0,,,,,False,closed,['Autres'],[],[]
10.1016/j.buildenv.2011.02.001,hal-01145124,in,closed,High resolution thermo-radiative modeling of an urban fragment in Marseilles city center during the UBL-ESCOMPTE campaign,ART,notice,False,2015-04-23 14:44:48,,False,['0.phys'],[],[],2011-09-01,2011,Building and Environment,0360-1323,Elsevier BV,Articles dans une revue,0360-1323,closed,,,False,,,,4.0,,,,,False,closed,['Autres'],[],[]
10.1016/j.buildenv.2013.12.012,hal-01870606,in,closed,A hydrothermal model to assess the impact of green walls on urban microclimate and building energy consumption,ART,notice,False,2018-09-07 22:43:17,,True,"['0.spi', '0.sde']",[],[],2014-03-01,2014,Building and Environment,0360-1323,Elsevier BV,Articles dans une revue,0360-1323,closed,,,False,,,,3.0,,,,,False,closed,"[""Sciences de l'ingénieur"", ""Sciences de l'environnement""]",[],[]
10.1016/j.buildenv.2017.08.009,hal-01630175,in,oa,Urban heat island temporal and spatial variations: Empirical modeling from geographical and meteorological data,ART,file,True,2018-06-01 10:08:19,,True,['0.shs'],['1.shs.archi'],[],2017-11-01,2017,Building and Environment,0360-1323,Elsevier BV,Articles dans une revue,0360-1323,green,repository,submittedVersion,False,,,,5.0,,,,,True,repository,"[""Sciences de l'Homme et de la Société""]","[""Architecture, aménagement de l'espace""]",[]
10.1016/j.chb.2020.106374,hal-02551772,in,oa,"Effects of physical, non-immersive virtual, and immersive virtual store environments on consumers' perceptions and purchase behavior",ART,file,True,2020-04-23 10:15:30,http://creativecommons.org/licenses/by-nc-nd/,True,"['0.info', '0.scco']",[],['1.info.info-gr'],2020-09-01,2020,Computers in Human Behavior,0747-5632,Elsevier BV,Articles dans une revue,0747-5632,bronze,repository;publisher,submittedVersion;acceptedVersion,False,cc-by-nc-nd,,,6.0,,,,,True,publisher;repository,"['Informatique', 'Autres']",[],"[""Synthèse d'image et réalité virtuelle""]"
10.1016/j.daach.2015.02.002,hal-01617172,in,oa,"Intuition and analysis in the recording, interpretation and public translation of Neolithic engraved signs in western France",ART,file,True,2018-09-06 15:36:58,,True,['0.shs'],"['1.shs.archeo', '1.shs.archi']",[],2015-01-01,2015,Digital Applications in Archaeology and Cultural Heritage,2212-0548,Elsevier BV,Articles dans une revue,2212-0548,green,repository,publishedVersion,False,,,,3.0,,,,,True,repository,"[""Sciences de l'Homme et de la Société""]","['Autres', ""Architecture, aménagement de l'espace""]",[]
10.1016/j.egypro.2015.11.088,hal-01799920,in,oa,SOLENE-microclimate: A Tool to Evaluate Envelopes Efficiency on Energy Consumption at District Scale.,ART,notice,True,2018-05-25 13:07:09,,True,"['0.spi', '0.sde']",[],[],2015-11-01,2015,Energy Procedia,1876-6102,Elsevier BV,Articles dans une revue,1876-6102,gold,publisher,publishedVersion,False,cc-by-nc-nd,,True,3.0,,journal_in_openapc,2084.793103448276,EUR,True,publisher,"[""Sciences de l'ingénieur"", ""Sciences de l'environnement""]",[],[]
10.1016/j.egypro.2017.07.126,hal-01581748,in,oa,Optimized pulse transformer for step-up DC-DC converter,COMM,notice,True,2017-09-05 09:40:53,,True,"['0.phys', '0.spi']",[],[],2017-07-01,2017,Energy Procedia,1876-6102,Elsevier BV,Communications dans un congrès,1876-6102,gold,publisher,publishedVersion,False,cc-by-nc-nd,,True,5.0,,,,,True,publisher,"['Autres', ""Sciences de l'ingénieur""]",[],[]
10.1016/j.enbuild.2004.01.010,halshs-00573759,in,closed,A geometrical framework for solving sunlighting problems within CAD systems,ART,notice,False,2011-03-04 15:29:29,,True,['0.shs'],['1.shs.archi'],[],2004-04-01,2004,Energy and Buildings,0378-7788,Elsevier BV,Articles dans une revue,0378-7788,closed,,,False,,,,2.0,,,,,False,closed,"[""Sciences de l'Homme et de la Société""]","[""Architecture, aménagement de l'espace""]",[]
10.1016/j.enbuild.2011.02.010,hal-01870609,in,closed,Microclimatic coupling as a solution to improve building energy simulation in an urban context,ART,notice,False,2018-09-07 22:47:13,,True,"['0.spi', '0.sde']",[],[],2011-07-01,2011,Energy and Buildings,0378-7788,Elsevier BV,Articles dans une revue,0378-7788,closed,,,False,,,,3.0,,,,,False,closed,"[""Sciences de l'ingénieur"", ""Sciences de l'environnement""]",[],[]
10.1016/j.enbuild.2012.08.048,hal-00947577,in,oa,Application of sensitivity analysis in building energy simulations: Combining first- and second-order elementary effects methods,ART,arxiv,True,2014-02-17 09:43:36,,False,['0.spi'],[],[],2014-01-01,2014,Energy and Buildings,0378-7788,Elsevier BV,Articles dans une revue,0378-7788,green,repository,submittedVersion,False,,,,4.0,,,,,True,repository,"[""Sciences de l'ingénieur""]",[],[]
10.1016/j.enbuild.2015.06.030,hal-01583195,in,closed,Preliminary study of the impact of urban greenery types on energy consumption of building at a district scale: Academic study on a canyon street in Nantes (France) weather conditions,ART,notice,False,2017-09-06 21:10:39,,True,"['0.sde', '0.spi']",[],[],2016-02-01,2016,Energy and Buildings,0378-7788,Elsevier BV,Articles dans une revue,0378-7788,closed,,,False,,,,3.0,,,,,False,closed,"[""Sciences de l'environnement"", ""Sciences de l'ingénieur""]",[],[]
10.1016/j.enbuild.2015.06.032,hal-01799917,in,closed,Simulation tools to assess microclimate and building energy – A case study on the design of a new district,ART,notice,False,2018-05-25 13:03:49,,True,"['0.spi', '0.sde']",[],[],2016-02-01,2016,Energy and Buildings,0378-7788,Elsevier BV,Articles dans une revue,0378-7788,closed,,,False,,,,4.0,,,,,False,closed,"[""Sciences de l'ingénieur"", ""Sciences de l'environnement""]",[],[]
10.1016/j.foar.2016.02.001,halshs-01330999,in,oa,Thermal comfort in twentieth-century architectural heritage: Two houses of Le Corbusier and André Wogenscky,ART,file,True,2016-06-15 17:47:49,,True,['0.shs'],['1.shs.archi'],[],2016-06-01,2016,Frontiers of Architectural Research,2095-2635,Elsevier BV,Articles dans une revue,2095-2635,gold,repository;publisher,submittedVersion;publishedVersion,False,cc-by-nc-nd,True,True,1.0,,apc_journals_in_doaj,,,True,publisher;repository,"[""Sciences de l'Homme et de la Société""]","[""Architecture, aménagement de l'espace""]",[]
10.1016/j.geoforum.2013.04.028,hal-00978316,in,oa,"‘Pour votre tranquillité’: Ambiance, atmosphere, and surveillance",ART,file,True,2021-03-09 09:52:26,,True,['0.shs'],['1.shs.archi'],[],2013-10-01,2013,Geoforum,0016-7185,Elsevier BV,Articles dans une revue,0016-7185,green,repository,submittedVersion,False,,,,6.0,,,,,True,repository,"[""Sciences de l'Homme et de la Société""]","[""Architecture, aménagement de l'espace""]",[]
10.1016/j.jretconser.2019.01.010,hal-01995916,in,oa,Consumer perceptions and purchase behavior toward imperfect fruits and vegetables in an immersive virtual reality grocery store,ART,file,True,2019-01-29 15:48:32,,True,['0.info'],[],['1.info.info-gr'],2019-05-01,2019,Journal of Retailing and Consumer Services,0969-6989,Elsevier BV,Articles dans une revue,0969-6989,green,repository,submittedVersion;acceptedVersion,False,pd,,,6.0,,,,,True,repository,['Informatique'],[],"[""Synthèse d'image et réalité virtuelle""]"
10.1016/j.rser.2019.109390,hal-03489027,in,closed,How building energy models take the local climate into account in an urban context – A review,ART,notice,False,2021-12-17 16:30:03,,False,['0.spi'],[],[],2019-12-01,2019,Renewable and Sustainable Energy Reviews,1364-0321,Elsevier BV,Articles dans une revue,1364-0321,closed,,,False,,,,7.0,,,,,False,closed,"[""Sciences de l'ingénieur""]",[],[]
10.1016/j.scs.2020.102633,hal-03046054,in,closed,Assessing the effects of urban street trees on building cooling energy needs: The role of foliage density and planting pattern,ART,notice,False,2020-12-08 11:47:35,,True,"['0.info', '0.shs', '0.sde']",['1.shs.archi'],['1.info.info-mo'],2021-02-01,2021,Sustainable Cities and Society,2210-6707,Elsevier BV,Articles dans une revue,2210-6707,closed,,,False,,,,3.0,,,,,False,closed,"['Informatique', ""Sciences de l'Homme et de la Société"", ""Sciences de l'environnement""]","[""Architecture, aménagement de l'espace""]",['Modélisation et simulation']
10.1016/j.uclim.2015.04.001,hal-01141712,in,oa,Radiative and heat storage properties of the urban fabric derived from analysis of surface forms,ART,file,True,2018-05-31 11:56:32,,True,"['0.sde', '0.shs', '0.spi']",['1.shs.geo'],[],2015-06-01,2015,Urban Climate,2212-0955,Elsevier BV,Articles dans une revue,2212-0955,green,repository,submittedVersion,False,,,,8.0,,,,,True,repository,"[""Sciences de l'environnement"", ""Sciences de l'Homme et de la Société"", ""Sciences de l'ingénieur""]",['Géographie'],[]
10.1016/j.uclim.2015.07.004,hal-01667973,in,closed,The use of SOLENE-microclimat model to assess adaptation strategies at the district scale,ART,notice,False,2017-12-19 16:56:30,,True,"['0.sde', '0.spi']",[],[],2015-12-01,2015,Urban Climate,2212-0955,Elsevier BV,Articles dans une revue,2212-0955,closed,,,False,,,,4.0,,,,,False,closed,"[""Sciences de l'environnement"", ""Sciences de l'ingénieur""]",[],[]
