doi,halId,hal_coverage,upw_coverage,title,hal_docType,hal_location,hal_openAccess_bool,hal_submittedDate,hal_licence,hal_selfArchiving,hal_domain,hal_shsdomain,hal_infodomain,published_date,published_year,journal_name,journal_issns,publisher,genre,journal_issn_l,oa_status,upw_location,version,suspicious_journal,licence,journal_is_in_doaj,journal_is_oa,author_count,is_paratext,apc_tracking,apc_amount,apc_currency,is_oa,oa_type,scientific_field,shs_field,info_field
,hal-00785443,in,missing,Introducing Virtual Reality for ergonomic studies in the car manufacturing industry,COMM,notice,False,2013-02-06 11:02:15,,True,['0.info'],[],['1.info.info-gr'],2002-04,2002,,False,,Communications dans un congrès,,,,,False,,,,4.0,,doi_in_openapc,unknown,EUR,False,closed,['Informatique'],[],"[""Synthèse d'image et réalité virtuelle""]"
,hal-00785453,in,missing,"Human Factors and Ergonomic Studies for the Car Manufacturing Industry,, , U.K, August 18-21, 2002.",COMM,notice,False,2013-02-06 11:07:34,,True,['0.info'],[],['1.info.info-gr'],2002-08-21,2002,,False,,Communications dans un congrès,,,,,False,,,,4.0,,doi_in_openapc,unknown,EUR,False,closed,['Informatique'],[],"[""Synthèse d'image et réalité virtuelle""]"
,hal-00785613,in,missing,La réalité virtuelle,COUV,notice,False,2013-02-06 15:06:33,,True,['0.info'],[],['1.info.info-gr'],2001-11,2001,,False,,Chapitres d'ouvrage,,,,,False,,,,2.0,,doi_in_openapc,unknown,EUR,False,closed,['Informatique'],[],"[""Synthèse d'image et réalité virtuelle""]"
,hal-00786465,in,missing,Amélioration des images stéréoscopiques,COMM,notice,False,2013-02-08 16:07:55,,True,['0.info'],[],['1.info.info-gr'],2007-10-26,2007,,False,,Communications dans un congrès,,,,,False,,,,3.0,,doi_in_openapc,unknown,EUR,False,closed,['Informatique'],[],"[""Synthèse d'image et réalité virtuelle""]"
,hal-00786603,in,missing,Psychophysique et techniques de la vision stéréoscopique,COMM,notice,False,2013-02-09 10:35:47,,True,['0.info'],[],['1.info.info-gr'],2003-05-19,2003,,False,,Communications dans un congrès,,,,,False,,,,2.0,,doi_in_openapc,unknown,EUR,False,closed,['Informatique'],[],"[""Synthèse d'image et réalité virtuelle""]"
,hal-00786604,in,missing,"Virtual Reality : CAD and Beyond, Virtual Concept 2002",COMM,notice,False,2013-02-09 10:40:12,,True,['0.info'],[],['1.info.info-gr'],2002-10-19,2002,,False,,Communications dans un congrès,,,,,False,,,,3.0,,doi_in_openapc,unknown,EUR,False,closed,['Informatique'],[],"[""Synthèse d'image et réalité virtuelle""]"
,hal-00786760,in,missing,Tutorial : Visual Immersion for design,COMM,notice,False,2013-02-10 16:15:06,,True,['0.info'],[],['1.info.info-gr'],2003-11-05,2003,,False,,Communications dans un congrès,,,,,False,,,,2.0,,doi_in_openapc,unknown,EUR,False,closed,['Informatique'],[],"[""Synthèse d'image et réalité virtuelle""]"
,hal-00786768,in,missing,Approche méthodologique de la réalité virtuelle pour la CAO,COMM,notice,False,2013-02-10 16:28:09,,True,['0.info'],[],['1.info.info-gr'],2001-03,2001,,False,,Communications dans un congrès,,,,,False,,,,2.0,,doi_in_openapc,unknown,EUR,False,closed,['Informatique'],[],"[""Synthèse d'image et réalité virtuelle""]"
,hal-00810612,in,missing,The sonic atmosphere as a historical object?,COMM,file,True,2012-04-23 10:00:00,,False,"['0.spi', '0.phys']",[],[],2012-04-23,2012,,False,,Communications dans un congrès,,,,,False,,,,1.0,,doi_in_openapc,unknown,EUR,True,repository,"[""Sciences de l'ingénieur"", 'Autres']",[],[]
,hal-00816843,in,missing,Vers la conception assistée de modeleurs déclaratifs,ART,notice,False,2013-04-23 09:39:19,,True,['0.info'],[],['1.info.info-gr'],1999,1999,Revue Internationale de CFAO et d'informatique graphique,1266-0175,Hermès,Articles dans une revue,,,,,False,,,,2.0,,doi_in_openapc,unknown,EUR,False,closed,['Informatique'],[],"[""Synthèse d'image et réalité virtuelle""]"
,hal-00910594,in,missing,Metabolic emergent auditory effects by means of physical particle modeling : the example of musical sand,COMM,file,True,2014-05-22 15:39:44,,True,['0.info'],[],"['1.info.info-gr', '1.info.info-mo']",2003,2003,,False,,Communications dans un congrès,,,,,False,,,,3.0,,doi_in_openapc,unknown,EUR,True,repository,['Informatique'],[],"[""Synthèse d'image et réalité virtuelle"", 'Modélisation et simulation']"
,hal-00910596,in,missing,Modèle physique et espaces de représentations. Application à quelques phénomènes collectifs en environnement construit,COMM,file,True,2014-05-22 12:34:17,,True,"['0.info', '0.shs']",['1.shs.archi'],['1.info.info-gr'],1998,1998,,False,,Communications dans un congrès,,,,,False,,,,2.0,,doi_in_openapc,unknown,EUR,True,repository,"['Informatique', ""Sciences de l'Homme et de la Société""]","[""Architecture, aménagement de l'espace""]","[""Synthèse d'image et réalité virtuelle""]"
,hal-00910609,in,missing,Conduites en milieu urbain. Analyse in situ et expérimentation virtuelle,COMM,file,True,2014-06-03 13:54:06,,True,"['0.info', '0.shs']",['1.shs.archi'],['1.info.info-gr'],1999,1999,,False,,Communications dans un congrès,,,,,False,,,,3.0,,doi_in_openapc,unknown,EUR,True,repository,"['Informatique', ""Sciences de l'Homme et de la Société""]","[""Architecture, aménagement de l'espace""]","[""Synthèse d'image et réalité virtuelle""]"
,hal-00910659,in,missing,Décrire / Modéliser les dynamiques de cheminement : du rôle des ambiances à l'hypothèse d'un modèle physique,COMM,file,True,2017-05-09 12:06:44,,True,"['0.info', '0.shs']",['1.shs.archi'],['1.info.info-gr'],2009-05-15,2009,,False,,Communications dans un congrès,,,,,False,,,,2.0,,doi_in_openapc,unknown,EUR,True,repository,"['Informatique', ""Sciences de l'Homme et de la Société""]","[""Architecture, aménagement de l'espace""]","[""Synthèse d'image et réalité virtuelle""]"
,hal-00911154,in,missing,Morale et politique dans le monument historique,COUV,file,True,2013-11-28 18:31:03,,True,['0.shs'],"['1.shs.anthro-se', '1.shs.socio']",[],2013,2013,,False,,Chapitres d'ouvrage,,,,,False,,,,2.0,,doi_in_openapc,unknown,EUR,True,repository,"[""Sciences de l'Homme et de la Société""]","['Anthropo', 'Sociologie']",[]
,hal-00923808,in,missing,L'écoute-en-action,COUV,file,True,2014-01-04 21:58:03,,True,['0.shs'],['1.shs.socio'],[],2009,2009,,False,,Chapitres d'ouvrage,,,,,False,,,,1.0,,doi_in_openapc,unknown,EUR,True,repository,"[""Sciences de l'Homme et de la Société""]",['Sociologie'],[]
,hal-00968248,in,missing,Réalité virtuelle - Concepts et outils,COUV,notice,False,2014-03-31 16:46:30,,True,['0.info'],[],['1.info.info-gr'],2014-02-10,2014,,False,,Chapitres d'ouvrage,,,,,False,,,,3.0,,doi_in_openapc,unknown,EUR,False,closed,['Informatique'],[],"[""Synthèse d'image et réalité virtuelle""]"
,hal-00974804,in,missing,Du programme d'assainissement acoustique au projet de requalification sonore. L'exemple du viaduc de Chillon,ART,file,True,2017-06-19 14:47:47,http://creativecommons.org/licenses/by-nc-nd/,False,['0.shs'],['1.shs.archi'],[],2004,2004,Les Cahiers de l'ASPAN : Association Suisse Pour l'Aménagement National,False,,Articles dans une revue,,,,,False,,,,1.0,,doi_in_openapc,unknown,EUR,True,repository,"[""Sciences de l'Homme et de la Société""]","[""Architecture, aménagement de l'espace""]",[]
,hal-00974805,in,missing,L'aménagement des territoires et les professionnels de la maîtrise d'oeuvre,ART,file,True,2017-06-19 14:38:28,http://creativecommons.org/licenses/by-nc-nd/,False,['0.shs'],['1.shs.archi'],[],2006,2006,Cahiers thématiques,1625-9505,École nationale supérieure d’architecture et de paysage de Lille,Articles dans une revue,,,,,False,,,,1.0,,doi_in_openapc,unknown,EUR,True,repository,"[""Sciences de l'Homme et de la Société""]","[""Architecture, aménagement de l'espace""]",[]
,hal-00975415,in,missing,Amiens 2030 - Le quotidien en projets,DOUV,file,True,2017-05-09 12:03:28,,True,['0.shs'],['1.shs.archi'],[],2013-01-01,2013,,False,,Direction d'ouvrages,,,,,False,,,,31.0,,doi_in_openapc,unknown,EUR,True,repository,"[""Sciences de l'Homme et de la Société""]","[""Architecture, aménagement de l'espace""]",[]
,hal-00978318,in,missing,A comme Ambiance (s),ART,file,True,2019-06-12 10:03:49,,False,['0.shs'],['1.shs.archi'],[],2007,2007,Cahiers de la recherche architecturale et urbaine,False,,Articles dans une revue,,,,,False,,,,1.0,,doi_in_openapc,unknown,EUR,True,repository,"[""Sciences de l'Homme et de la Société""]","[""Architecture, aménagement de l'espace""]",[]
,hal-00978320,in,missing,L'espace sonore de la ville au XIXème siècle,ART,file,True,2019-03-26 16:34:09,,False,['0.shs'],['1.shs.archi'],[],2007,2007,Rue Descartes,"1144-0821,2102-5819",Presses Universitaires de France,Articles dans une revue,,,,,False,,,,1.0,,doi_in_openapc,unknown,EUR,True,repository,"[""Sciences de l'Homme et de la Société""]","[""Architecture, aménagement de l'espace""]",[]
,hal-00978322,in,missing,L'atmosphère de la multitude,ART,file,True,2019-03-26 15:47:13,,False,['0.shs'],['1.shs.archi'],[],2011,2011,"Faces, Journal d'architecture",0258-6800,Infolio éditions,Articles dans une revue,,,,,False,,,,3.0,,doi_in_openapc,unknown,EUR,True,repository,"[""Sciences de l'Homme et de la Société""]","[""Architecture, aménagement de l'espace""]",[]
,hal-00978323,in,missing,New architectural forms to increase dew collection,ART,file,True,2017-05-19 19:42:45,,True,['0.shs'],['1.shs.archi'],[],2013,2013,Chemical Engineering Transactions,2283-9216,AIDIC,Articles dans une revue,,,,,False,,,,5.0,,doi_in_openapc,unknown,EUR,True,repository,"[""Sciences de l'Homme et de la Société""]","[""Architecture, aménagement de l'espace""]",[]
,hal-00978327,in,missing,Des jardins pour ménager les bords de route,ART,notice,False,2014-04-14 09:54:49,,True,['0.shs'],['1.shs.archi'],[],2013,2013,Anthos. L'architecture du paysage en France,False,,Articles dans une revue,,,,,False,,,,2.0,,doi_in_openapc,unknown,EUR,False,closed,"[""Sciences de l'Homme et de la Société""]","[""Architecture, aménagement de l'espace""]",[]
,hal-00978331,in,missing,Les chorégraphies urbaines des piétons parisiens : entre règles spatiales et règles sociales,ART,notice,False,2014-04-14 09:54:53,,False,['0.shs'],['1.shs.archi'],[],2009,2009,Géographie et cultures,"1165-0354,2267-6759",L'Harmattan,Articles dans une revue,,,,,False,,,,1.0,,doi_in_openapc,unknown,EUR,False,closed,"[""Sciences de l'Homme et de la Société""]","[""Architecture, aménagement de l'espace""]",[]
,hal-00978332,in,missing,De l'architecture événement à l'événement ordinaire : du tremblement de terre du Belice à la réalité de Gibellina Nuova,ART,notice,False,2014-04-14 09:54:54,,False,['0.shs'],['1.shs.archi'],[],2009,2009,Cahiers thématiques,1625-9505,École nationale supérieure d’architecture et de paysage de Lille,Articles dans une revue,,,,,False,,,,1.0,,doi_in_openapc,unknown,EUR,False,closed,"[""Sciences de l'Homme et de la Société""]","[""Architecture, aménagement de l'espace""]",[]
,hal-00978333,in,missing,Typische Atmosphären städtischer Plätze. Auf dem Weg zu einer anwendungsorientierten Atmosphärenforschung,ART,notice,False,2014-04-14 09:54:55,,True,['0.shs'],['1.shs.archi'],[],2008,2008,Die Alte Stadt,False,,Articles dans une revue,,,,,False,,,,1.0,,doi_in_openapc,unknown,EUR,False,closed,"[""Sciences de l'Homme et de la Société""]","[""Architecture, aménagement de l'espace""]",[]
,hal-00978334,in,missing,Konturen einer situativen Umweltästhetik,ART,notice,False,2014-04-14 09:54:56,,True,['0.shs'],['1.shs.archi'],[],2012,2012,Geographische Zeitschrift,False,Franz Steiner Verlag,Articles dans une revue,,,,,False,,,,1.0,,doi_in_openapc,unknown,EUR,False,closed,"[""Sciences de l'Homme et de la Société""]","[""Architecture, aménagement de l'espace""]",[]
,hal-00978335,in,missing,Unterwegs in fremden Umgebungen. Ein praxeologischer Zugang zum Wayfinding von Fußgängern,ART,notice,False,2014-04-14 09:54:56,,True,['0.shs'],['1.shs.archi'],[],2011,2011,Raumforschung und Raumordnung,False,,Articles dans une revue,,,,,False,,,,2.0,,doi_in_openapc,unknown,EUR,False,closed,"[""Sciences de l'Homme et de la Société""]","[""Architecture, aménagement de l'espace""]",[]
,hal-00978336,in,missing,"Vidéographie territoriale, retour d'expérimentation : la vidéo mosaïque",ART,notice,False,2014-04-14 09:54:57,,False,['0.shs'],['1.shs.archi'],[],2012-10,2012,Les Carnets du paysage,1296-0101,Actes Sud/ École Nationale Supérieure du Paysage,Articles dans une revue,,,,,False,,,,1.0,,doi_in_openapc,unknown,EUR,False,closed,"[""Sciences de l'Homme et de la Société""]","[""Architecture, aménagement de l'espace""]",[]
,hal-00978338,in,missing,"Note de lecture de Richard, Klein, Rob Mallet-Stevens. La villa Cavrois",ART,notice,False,2014-04-14 09:55:01,,False,['0.shs'],['1.shs.archi'],[],2007,2007,Cahiers de la recherche architecturale et urbaine,False,,Articles dans une revue,,,,,False,,,,1.0,,doi_in_openapc,unknown,EUR,False,closed,"[""Sciences de l'Homme et de la Société""]","[""Architecture, aménagement de l'espace""]",[]
,hal-00978340,in,missing,"Tempesta sonora o fuoco di campo sonoro. Do the Right Thing, interazione e ascolto musicale (in) pubblico = Sonic storm or sonic field fire: Do the Right Thing, interaction and music listening in public",ART,notice,False,2014-04-14 09:55:25,,False,['0.shs'],['1.shs.archi'],[],2013,2013,Studi culturali,1824-369X,Il Mulino,Articles dans une revue,,,,,False,,,,1.0,,doi_in_openapc,unknown,EUR,False,closed,"[""Sciences de l'Homme et de la Société""]","[""Architecture, aménagement de l'espace""]",[]
,hal-00978341,in,missing,La fabrique de la rue en marche. Essai sur l'altération des ambiances urbaines,ART,file,True,2017-07-11 10:16:20,http://creativecommons.org/licenses/by-nc-nd/,False,['0.shs'],['1.shs.archi'],[],2007,2007,Flux - Cahiers scientifiques internationaux Réseaux et territoires,"1154-2721,1958-9557",Metropolis / Université Paris-Est Marne la Vallée,Articles dans une revue,,,,,False,,,,1.0,,doi_in_openapc,unknown,EUR,True,repository,"[""Sciences de l'Homme et de la Société""]","[""Architecture, aménagement de l'espace""]",[]
,hal-00978343,in,missing,The Sensory Fabric of Urban Ambiances,ART,file,True,2017-07-10 17:56:14,http://creativecommons.org/licenses/by-nc-nd/,False,['0.shs'],['1.shs.archi'],[],2011,2011,Senses and Society,"1745-8927,1745-8935",Taylor & Francis (Routledge),Articles dans une revue,,,,,False,,,,1.0,,doi_in_openapc,unknown,EUR,True,repository,"[""Sciences de l'Homme et de la Société""]","[""Architecture, aménagement de l'espace""]",[]
,hal-00978345,in,missing,Petite archéologie de la notion d'ambiance,ART,file,True,2017-07-10 17:20:48,http://creativecommons.org/licenses/by-nc-nd/,False,['0.shs'],['1.shs.archi'],[],2012,2012,Communications,"0341-2059,1613-4087",De Gruyter,Articles dans une revue,,,,,False,,,,1.0,,doi_in_openapc,unknown,EUR,True,repository,"[""Sciences de l'Homme et de la Société""]","[""Architecture, aménagement de l'espace""]",[]
,hal-00980727,in,missing,"Une ""Expertise Ambiance"" est-elle possible ? Réserves, propositions et plaidoyer",ART,file,True,2017-06-19 17:01:49,http://creativecommons.org/licenses/by-nc-nd/,False,['0.shs'],['1.shs.archi'],[],2006,2006,Cahiers RAMAU,1623-1333,Éditions de la Villette,Articles dans une revue,,,,,False,,,,1.0,,doi_in_openapc,unknown,EUR,True,repository,"[""Sciences de l'Homme et de la Société""]","[""Architecture, aménagement de l'espace""]",[]
,hal-00980728,in,missing,L'invité,ART,notice,False,2014-04-18 16:41:31,,False,['0.shs'],['1.shs.archi'],[],2008,2008,Urbanisme,1240-0874,Publications d'architecture et d'urbanisme,Articles dans une revue,,,,,False,,,,2.0,,doi_in_openapc,unknown,EUR,False,closed,"[""Sciences de l'Homme et de la Société""]","[""Architecture, aménagement de l'espace""]",[]
,hal-00980729,in,missing,"De sonishe ervaring. Een gids van alledaagse geluiden (geselecteerde passages) / Sonic Experience, A Guide to Everydays Sounds (selected excerpts)",ART,notice,False,2014-04-18 16:41:32,,False,['0.shs'],['1.shs.archi'],[],2009-06,2009,OASE Tidschrift voor architectuur / Journal for Architecture,False,,Articles dans une revue,,,,,False,,,,2.0,,doi_in_openapc,unknown,EUR,False,closed,"[""Sciences de l'Homme et de la Société""]","[""Architecture, aménagement de l'espace""]",[]
,hal-00980730,in,missing,La réception des spectacles de rue : pratiques et perceptions de l'espace,ART,file,True,2017-09-18 17:34:26,http://creativecommons.org/licenses/by-nc-nd/,False,['0.shs'],['1.shs.archi'],[],2005,2005,Carnets de bord : revue de jeunes chercheurs en sciences humaines,False,,Articles dans une revue,,,,,False,,,,1.0,,doi_in_openapc,unknown,EUR,True,repository,"[""Sciences de l'Homme et de la Société""]","[""Architecture, aménagement de l'espace""]",[]
,hal-00980732,in,missing,La clarté de l'audible dans l'espace architectural et urbain,ART,file,True,2019-06-24 09:34:00,,False,['0.shs'],['1.shs.archi'],[],2005,2005,Voir (barré),0777-1266,Centre de recherche sur les aspects culturels de la vision,Articles dans une revue,,,,,False,,,,1.0,,doi_in_openapc,unknown,EUR,True,repository,"[""Sciences de l'Homme et de la Société""]","[""Architecture, aménagement de l'espace""]",[]
,hal-00980734,in,missing,Filmer l'ambiance urbaine : Les dispositifs vidéographiques à l'œuvre chez William H. Whyte dans La vie sociale des petits espaces urbains,ART,notice,False,2014-04-18 16:41:38,,False,['0.shs'],['1.shs.archi'],[],2013-06-13,2013,"Ambiances. Environnement sensible, architecture et espace urbain",2266-839X,UMR 1563 - Ambiances Architecturales et Urbaines,Articles dans une revue,,,,,False,,,,1.0,,doi_in_openapc,unknown,EUR,False,closed,"[""Sciences de l'Homme et de la Société""]","[""Architecture, aménagement de l'espace""]",[]
,hal-00980735,in,missing,Approche écologique de kinesthèses sonores : expérimentation d'un prototype d'abri public et ergonomie acoustique,ART,file,True,2015-06-25 11:38:12,http://creativecommons.org/licenses/by-nc-nd/,False,['0.shs'],['1.shs.archi'],[],2005,2005,Acoustique et Techniques,False,,Articles dans une revue,,,,,False,,,,1.0,,doi_in_openapc,unknown,EUR,True,repository,"[""Sciences de l'Homme et de la Société""]","[""Architecture, aménagement de l'espace""]",[]
,hal-00980736,in,missing,Contribution to a phono-kinetic approach : An architectural experiment to design a public shelter,ART,notice,False,2014-04-18 16:41:40,,False,['0.shs'],['1.shs.archi'],[],2011,2011,SoundEffects,False,,Articles dans une revue,,,,,False,,,,1.0,,doi_in_openapc,unknown,EUR,False,closed,"[""Sciences de l'Homme et de la Société""]","[""Architecture, aménagement de l'espace""]",[]
,hal-00980737,in,missing,El urbanismo y lo urbano en la transformación de Bogotá. Discursos expertos y palabras de los habitantes,ART,notice,False,2014-04-18 16:41:41,,False,['0.shs'],['1.shs.archi'],[],2012-12,2012,DEARQ - Revista de arquitectura de la Universidad de los Andes (Bogotà),False,,Articles dans une revue,,,,,False,,,,2.0,,doi_in_openapc,unknown,EUR,False,closed,"[""Sciences de l'Homme et de la Société""]","[""Architecture, aménagement de l'espace""]",[]
,hal-00980739,in,missing,"Vidéo et architecture au-delà du décor cinématographique, une approche transdisciplinaire",ART,notice,False,2014-04-18 16:42:01,,False,['0.shs'],['1.shs.archi'],[],2011,2011,Oscillations,2259-0730,Association Oscillations,Articles dans une revue,,,,,False,,,,1.0,,doi_in_openapc,unknown,EUR,False,closed,"[""Sciences de l'Homme et de la Société""]","[""Architecture, aménagement de l'espace""]",[]
,hal-00980740,in,missing,Itinéraire de Jean Bricard,ART,notice,False,2014-04-18 16:42:11,,False,['0.shs'],['1.shs.archi'],[],2009-02,2009,Fusées,False,,Articles dans une revue,,,,,False,,,,2.0,,doi_in_openapc,unknown,EUR,False,closed,"[""Sciences de l'Homme et de la Société""]","[""Architecture, aménagement de l'espace""]",[]
,hal-00980742,in,missing,Psicologia ambiental e politica ambiental : estrategias de construcao do futuro,ART,file,True,2017-07-11 10:28:30,http://creativecommons.org/licenses/by-nc-nd/,False,['0.shs'],['1.shs.archi'],[],2005,2005,Psicologia USP (Universidade de Sao Paulo),False,,Articles dans une revue,,,,,False,,,,1.0,,doi_in_openapc,unknown,EUR,True,repository,"[""Sciences de l'Homme et de la Société""]","[""Architecture, aménagement de l'espace""]",[]
,hal-00980743,in,missing,A ambiência : trilhando caminho para uma perspectiva internacional,ART,file,True,2017-07-11 10:11:55,,False,['0.shs'],['1.shs.archi'],[],2008,2008,"RUA (Campinas, Brésil)",False,,Articles dans une revue,,,,,False,,,,1.0,,doi_in_openapc,unknown,EUR,True,repository,"[""Sciences de l'Homme et de la Société""]","[""Architecture, aménagement de l'espace""]",[]
,hal-00980744,in,missing,Towards a praxiology of sound environment,ART,file,True,2017-07-10 18:04:20,http://creativecommons.org/licenses/by-nc-nd/,False,['0.shs'],['1.shs.archi'],[],2010,2010,Sensory Studies - Sensorial Investigations,False,,Articles dans une revue,,,,,False,,,,1.0,,doi_in_openapc,unknown,EUR,True,repository,"[""Sciences de l'Homme et de la Société""]","[""Architecture, aménagement de l'espace""]",[]
,hal-00980746,in,missing,A Sonic Paradigm of Urban Ambiances,ART,file,True,2015-02-06 15:32:45,http://creativecommons.org/licenses/by-nc-nd/,True,['0.shs'],"['1.shs.archi', '1.shs.socio']",[],2011-10,2011,Journal of Sonic Studies,2212-6252,Leiden University Press (LUP),Articles dans une revue,,,,,False,,,,1.0,,doi_in_openapc,unknown,EUR,True,repository,"[""Sciences de l'Homme et de la Société""]","[""Architecture, aménagement de l'espace"", 'Sociologie']",[]
,hal-00980748,in,missing,A cidade a través dos sentidos,ART,notice,False,2014-04-18 16:43:27,,False,['0.shs'],['1.shs.archi'],[],2012,2012,Cadernos Proarq. Revista de arquitetura e urbanismo do Proarq,"1679-7604,2675-0392",Post-graduate Program in Architecture at FAU - Faculty of Architecture and Urbanism Universidade Federal do Rio de Janeiro,Articles dans une revue,,,,,False,,,,1.0,,doi_in_openapc,unknown,EUR,False,closed,"[""Sciences de l'Homme et de la Société""]","[""Architecture, aménagement de l'espace""]",[]
,hal-00980749,in,missing,O devir ambiente do mundo urbano,ART,notice,False,2014-04-18 16:43:28,,False,['0.shs'],['1.shs.archi'],[],2012,2012,Redobra,False,,Articles dans une revue,,,,,False,,,,1.0,,doi_in_openapc,unknown,EUR,False,closed,"[""Sciences de l'Homme et de la Société""]","[""Architecture, aménagement de l'espace""]",[]
,hal-00980751,in,missing,The city through the senses,ART,notice,False,2014-04-18 16:43:30,,False,['0.shs'],['1.shs.archi'],[],2012,2012,Cadernos Proarq. Revista de arquitetura e urbanismo do Proarq,"1679-7604,2675-0392",Post-graduate Program in Architecture at FAU - Faculty of Architecture and Urbanism Universidade Federal do Rio de Janeiro,Articles dans une revue,,,,,False,,,,1.0,,doi_in_openapc,unknown,EUR,False,closed,"[""Sciences de l'Homme et de la Société""]","[""Architecture, aménagement de l'espace""]",[]
,hal-00980752,in,missing,Commented City Walks,ART,file,True,2017-07-10 16:51:15,http://creativecommons.org/licenses/by-nc-nd/,False,['0.shs'],['1.shs.archi'],[],2013,2013,Wi: Journal of Mobile Culture,False,,Articles dans une revue,,,,,False,,,,1.0,,doi_in_openapc,unknown,EUR,True,repository,"[""Sciences de l'Homme et de la Société""]","[""Architecture, aménagement de l'espace""]",[]
,hal-00980755,in,missing,Ouverture au monde sensible,ART,notice,False,2014-04-18 16:43:34,,False,['0.shs'],['1.shs.archi'],[],2013,2013,"Ambiances. Environnement sensible, architecture et espace urbain",2266-839X,UMR 1563 - Ambiances Architecturales et Urbaines,Articles dans une revue,,,,,False,,,,1.0,,doi_in_openapc,unknown,EUR,False,closed,"[""Sciences de l'Homme et de la Société""]","[""Architecture, aménagement de l'espace""]",[]
,hal-00980759,in,missing,Entrevista Rachel Thomas por Fabiana Dultra Britto,ART,notice,False,2014-04-18 16:43:36,,True,['0.shs'],['1.shs.archi'],[],2013,2013,Redobra,False,,Articles dans une revue,,,,,False,,,,2.0,,doi_in_openapc,unknown,EUR,False,closed,"[""Sciences de l'Homme et de la Société""]","[""Architecture, aménagement de l'espace""]",[]
,hal-00993604,in,missing,"Performance technique, potentiel d'usages et perception esthétique. Un projet expérimental pour le viaduc de Chillon",COMM,file,True,2017-06-19 14:43:03,http://creativecommons.org/licenses/by-nc-nd/,False,['0.shs'],['1.shs.archi'],[],2006,2006,,False,,Communications dans un congrès,,,,,False,,,,1.0,,doi_in_openapc,unknown,EUR,True,repository,"[""Sciences de l'Homme et de la Société""]","[""Architecture, aménagement de l'espace""]",[]
,hal-00993606,in,missing,Repères pour la recherche doctorale en architecture,COMM,notice,False,2014-05-20 15:25:19,,False,['0.shs'],['1.shs.archi'],[],2006,2006,,False,,Communications dans un congrès,,,,,False,,,,1.0,,doi_in_openapc,unknown,EUR,False,closed,"[""Sciences de l'Homme et de la Société""]","[""Architecture, aménagement de l'espace""]",[]
,hal-00993607,in,missing,La cataphonique des quartiers construits au XIXème siècle,COMM,file,True,2019-06-20 14:00:15,,False,['0.shs'],['1.shs.archi'],[],2006,2006,,False,,Communications dans un congrès,,,,,False,,,,1.0,,doi_in_openapc,unknown,EUR,True,repository,"[""Sciences de l'Homme et de la Société""]","[""Architecture, aménagement de l'espace""]",[]
,hal-00993609,in,missing,Les facteurs lumineux des ambiances publiques nocturnes,COMM,notice,False,2014-05-20 15:25:44,,True,['0.shs'],['1.shs.archi'],[],2006,2006,,False,,Communications dans un congrès,,,,,False,,,,2.0,,doi_in_openapc,unknown,EUR,False,closed,"[""Sciences de l'Homme et de la Société""]","[""Architecture, aménagement de l'espace""]",[]
