doi,halId,hal_coverage,upw_coverage,title,hal_docType,hal_location,hal_openAccess_bool,hal_submittedDate,hal_licence,hal_selfArchiving,hal_domain,hal_shsdomain,hal_infodomain,published_date,published_year,journal_name,journal_issns,publisher,genre,journal_issn_l,oa_status,upw_location,version,suspicious_journal,licence,journal_is_in_doaj,journal_is_oa,author_count,is_paratext,apc_tracking,apc_amount,apc_currency,is_oa,oa_type,scientific_field,shs_field,info_field
,hal-01520075,in,missing,"Retour vers le futur. « Études sur Paris », un film d’André Sauvage (1928)",ART,file,True,2017-05-09 17:32:07,,False,['0.shs'],['1.shs.archi'],[],2014,2014,Les Cahiers de la recherche architecturale / Les Cahiers de la recherche architecturale et urbaine,"0150-9535,1296-4077",Paris : Ed. du patrimoine,Articles dans une revue,,,,,False,,,,4.0,,doi_in_openapc,unknown,EUR,True,repository,"[""Sciences de l'Homme et de la Société""]","[""Architecture, aménagement de l'espace""]",[]
,hal-01520076,in,missing,Effets sensibles en milieu urbain. Analyse in situ et expérimentation virtuelle,ART,file,True,2017-05-22 09:52:56,,False,['0.shs'],['1.shs.archi'],[],1998,1998,Acoustique et Techniques : trimestriel d'information des professionnels de l'acoustique,1263-8072,Neuilly-sur-Seine : Centre d'information et de documentation sur le bruit,Articles dans une revue,,,,,False,,,,2.0,,doi_in_openapc,unknown,EUR,True,repository,"[""Sciences de l'Homme et de la Société""]","[""Architecture, aménagement de l'espace""]",[]
,hal-01520077,in,missing,Comment observer une ambiance ?,ART,file,True,2017-05-09 17:32:08,,False,['0.shs'],['1.shs.archi'],[],1998,1998,Les Cahiers de la recherche architecturale / Les Cahiers de la recherche architecturale et urbaine,"0150-9535,1296-4077",Paris : Ed. du patrimoine,Articles dans une revue,,,,,False,,,,8.0,,doi_in_openapc,unknown,EUR,True,repository,"[""Sciences de l'Homme et de la Société""]","[""Architecture, aménagement de l'espace""]",[]
,hal-01520078,in,missing,Produire avec Perec,ART,file,True,2017-10-10 14:39:20,,True,['0.shs'],['1.shs.archi'],[],1998,1998,Le Cabinet d'amateur. Revue d'études perecquiennes,False,,Articles dans une revue,,,,,False,,,,2.0,,doi_in_openapc,unknown,EUR,True,repository,"[""Sciences de l'Homme et de la Société""]","[""Architecture, aménagement de l'espace""]",[]
,hal-01521471,in,missing,A functional typology of augmented reality applications based on their tracking requirements,COMM,notice,False,2017-05-11 17:53:17,,True,['0.info'],[],[],2011,2011,,False,,Communications dans un congrès,,,,,False,,,,3.0,,doi_in_openapc,unknown,EUR,False,closed,['Informatique'],[],[]
,hal-01521484,in,missing,Urban Spatiotemporal Data Modeling : Application to the Study of Pedestrian Walkways,COMM,notice,False,2017-05-11 18:08:27,,True,['0.info'],[],['1.info.info-mo'],2010,2010,,False,,Communications dans un congrès,,,,,False,,,,5.0,,doi_in_openapc,unknown,EUR,False,closed,['Informatique'],[],['Modélisation et simulation']
,hal-01521485,in,missing,Using Conceptual and Ontological Models for Tracking Changes of Spatio-Temporal Objects and Concepts over Time,COMM,notice,False,2017-05-11 18:08:28,,True,['0.info'],[],['1.info.info-mo'],2009,2009,,False,,Communications dans un congrès,,,,,False,,,,3.0,,doi_in_openapc,unknown,EUR,False,closed,['Informatique'],[],['Modélisation et simulation']
,hal-01521486,in,missing,Combining Conceptual and Ontological Models for Representing Spatio-Temporal Data and Semantic Evolution in GIS,COMM,notice,False,2017-05-11 18:08:28,,True,['0.info'],[],['1.info.info-mo'],2009,2009,,False,,Communications dans un congrès,,,,,False,,,,3.0,,doi_in_openapc,unknown,EUR,False,closed,['Informatique'],[],['Modélisation et simulation']
,hal-01521497,in,missing,Urban Localization based on Correspondences between Street Photographs and 2D Building GIS Layer,COMM,notice,False,2017-05-11 18:30:58,,True,['0.info'],[],['1.info.info-cv'],2009,2009,,False,,Communications dans un congrès,,,,,False,,,,3.0,,doi_in_openapc,unknown,EUR,False,closed,['Informatique'],[],['Vision par ordinateur et reconnaissance de formes']
,hal-01521499,in,missing,Outdoor Localization Approach Based on Image / GIS Correspondence Using a Simple 2D Building Layer,COMM,notice,False,2017-05-11 18:31:01,,True,['0.info'],[],['1.info.info-cv'],2008,2008,,False,,Communications dans un congrès,,,,,False,,,,3.0,,doi_in_openapc,unknown,EUR,False,closed,['Informatique'],[],['Vision par ordinateur et reconnaissance de formes']
,hal-01521507,in,missing,Facades modeling from a ground-view video with map constraints,COMM,notice,False,2017-05-11 19:02:27,,True,['0.info'],[],['1.info.info-cv'],2011,2011,,False,,Communications dans un congrès,,,,,False,,,,3.0,,doi_in_openapc,unknown,EUR,False,closed,['Informatique'],[],['Vision par ordinateur et reconnaissance de formes']
,hal-01521508,in,missing,Image based view localization system retrieving from a panorama database by surf,COMM,notice,False,2017-05-11 19:13:30,,True,['0.info'],[],['1.info.info-cv'],2009,2009,,False,,Communications dans un congrès,,,,,False,,,,5.0,,doi_in_openapc,unknown,EUR,False,closed,['Informatique'],[],['Vision par ordinateur et reconnaissance de formes']
,hal-01521509,in,missing,Change Detection Based on SURF and Color Edge Matching,COMM,notice,False,2017-05-11 19:13:31,,True,['0.info'],[],['1.info.info-cv'],2009,2009,,False,,Communications dans un congrès,,,,,False,,,,5.0,,doi_in_openapc,unknown,EUR,False,closed,['Informatique'],[],['Vision par ordinateur et reconnaissance de formes']
,hal-01521510,in,missing,Shape measurement system of foot sole surface from flatbed scanner image,COMM,notice,False,2017-05-11 19:13:31,,True,['0.info'],[],['1.info.info-cv'],2009,2009,,False,,Communications dans un congrès,,,,,False,,,,3.0,,doi_in_openapc,unknown,EUR,False,closed,['Informatique'],[],['Vision par ordinateur et reconnaissance de formes']
,hal-01521511,in,missing,AR GIS on a physical map based on map image retrieval using LLAH tracking,COMM,notice,False,2017-05-11 19:13:31,,True,['0.info'],[],['1.info.info-cv'],2009,2009,,False,,Communications dans un congrès,,,,,False,,,,4.0,,doi_in_openapc,unknown,EUR,False,closed,['Informatique'],[],['Vision par ordinateur et reconnaissance de formes']
,hal-01521512,in,missing,Ar city representation system based on map recognition using topological information,COMM,notice,False,2017-05-11 19:13:32,,True,['0.info'],[],['1.info.info-cv'],2009,2009,,False,,Communications dans un congrès,,,,,False,,,,4.0,,doi_in_openapc,unknown,EUR,False,closed,['Informatique'],[],['Vision par ordinateur et reconnaissance de formes']
,hal-01521513,in,missing,3D Shape Reconstruction of Foot Sole Surface using Flatbed Scanner,COMM,notice,False,2017-05-11 19:13:32,,True,['0.info'],[],['1.info.info-cv'],2009,2009,,False,,Communications dans un congrès,,,,,False,,,,3.0,,doi_in_openapc,unknown,EUR,False,closed,['Informatique'],[],['Vision par ordinateur et reconnaissance de formes']
,hal-01521514,in,missing,MapBook AiR : AR City Representation System on a Physical Map using Topological Information,COMM,notice,False,2017-05-11 19:13:32,,True,['0.info'],[],['1.info.info-cv'],2009,2009,,False,,Communications dans un congrès,,,,,False,,,,5.0,,doi_in_openapc,unknown,EUR,False,closed,['Informatique'],[],['Vision par ordinateur et reconnaissance de formes']
,hal-01521515,in,missing,AR Mapping of GIS Information by Pattern-based Tracking with Particle Filter,COMM,notice,False,2017-05-11 19:13:33,,True,['0.info'],[],['1.info.info-cv'],2008,2008,,False,,Communications dans un congrès,,,,,False,,,,4.0,,doi_in_openapc,unknown,EUR,False,closed,['Informatique'],[],['Vision par ordinateur et reconnaissance de formes']
,hal-01521516,in,missing,AR representation system for 3D GIS based on camera pose estimation using distribution of intersections,COMM,notice,False,2017-05-11 19:13:33,,True,['0.info'],[],['1.info.info-cv'],2008,2008,,False,,Communications dans un congrès,,,,,False,,,,5.0,,doi_in_openapc,unknown,EUR,False,closed,['Informatique'],[],['Vision par ordinateur et reconnaissance de formes']
,hal-01521517,in,missing,AR representation system for 3D GIS based on camera pose estimation using distribution of intersections (in Japonese),COMM,notice,False,2017-05-11 19:13:34,,True,['0.info'],[],['1.info.info-cv'],2008,2008,,False,,Communications dans un congrès,,,,,False,,,,5.0,,doi_in_openapc,unknown,EUR,False,closed,['Informatique'],[],['Vision par ordinateur et reconnaissance de formes']
,hal-01521520,in,missing,AR-based GIS: Towards closing the loop between acquisition and visualization of geographical data,COMM,notice,False,2017-05-11 19:22:52,,True,['0.info'],[],[],2009,2009,,False,,Communications dans un congrès,,,,,False,,,,3.0,,doi_in_openapc,unknown,EUR,False,closed,['Informatique'],[],[]
,hal-01521521,in,missing,An ontology-based model for representing evolution of both data and semantic in GIS,COMM,notice,False,2017-05-11 19:22:53,,True,['0.info'],[],[],2008,2008,,False,,Communications dans un congrès,,,,,False,,,,3.0,,doi_in_openapc,unknown,EUR,False,closed,['Informatique'],[],[]
,hal-01521549,in,missing,Un renouveau des pratiques muséographiques grâce au virtuel : un support à des applications pluridisciplinaires en pédagogie active,COMM,notice,False,2017-05-11 21:01:35,,True,"['0.phys', '0.info', '0.shs']",['1.shs.museo'],[],2011,2011,,False,,Communications dans un congrès,,,,,False,,,,4.0,,doi_in_openapc,unknown,EUR,False,closed,"['Autres', 'Informatique', ""Sciences de l'Homme et de la Société""]",['Héritage culturel et muséologie'],[]
,hal-01521552,in,missing,Les ambiances du projet urbain à travers les outils numériques mobiles,COMM,notice,False,2017-05-11 21:16:40,,True,['0.shs'],"['1.shs.archi', '1.shs.info']",[],2015,2015,,False,,Communications dans un congrès,,,,,False,,,,3.0,,doi_in_openapc,unknown,EUR,False,closed,"[""Sciences de l'Homme et de la Société""]","[""Architecture, aménagement de l'espace"", 'Autres']",[]
,hal-01521554,in,missing,"Outils numériques mobiles, ambiances et design urbain : quelques résultats issus du workshop pluridisciplinaire MOBIANCE",COMM,notice,False,2017-05-11 21:21:31,,True,['0.shs'],"['1.shs.archi', '1.shs.info']",[],2014,2014,,False,,Communications dans un congrès,,,,,False,,,,3.0,,doi_in_openapc,unknown,EUR,False,closed,"[""Sciences de l'Homme et de la Société""]","[""Architecture, aménagement de l'espace"", 'Autres']",[]
,hal-01521555,in,missing,UrbApp : On-site urban materials acquisition,COMM,notice,False,2017-05-11 21:29:04,,True,"['0.info', '0.shs']",['1.shs.archi'],[],2015,2015,,False,,Communications dans un congrès,,,,,False,,,,2.0,,doi_in_openapc,unknown,EUR,False,closed,"['Informatique', ""Sciences de l'Homme et de la Société""]","[""Architecture, aménagement de l'espace""]",[]
,hal-01529292,in,missing,Filmographie commentée,ART,file,True,2017-11-14 10:06:40,,False,['0.shs'],[],[],1999,1999,1895 revue d’histoire du cinéma,"0769-0959,1960-6176",Paris: Association française de recherche sur l'histoire du cinéma,Articles dans une revue,,,,,False,,,,3.0,,doi_in_openapc,unknown,EUR,True,repository,"[""Sciences de l'Homme et de la Société""]",[],[]
,hal-01533246,in,missing,Pour une ethnographie sensible de l’expérience urbaine ordinaire. Retours sur les coulisses de quelques travaux de terrain collaboratifs,ART,file,True,2017-06-06 12:02:15,http://creativecommons.org/licenses/by-nc-nd/,False,['0.shs'],"['1.shs.archi', '1.shs.socio']",[],2017,2017,Cadernos Proarq. Revista de arquitetura e urbanismo do Proarq,"1679-7604,2675-0392",Post-graduate Program in Architecture at FAU - Faculty of Architecture and Urbanism Universidade Federal do Rio de Janeiro,Articles dans une revue,,,,,False,,,,1.0,,doi_in_openapc,unknown,EUR,True,repository,"[""Sciences de l'Homme et de la Société""]","[""Architecture, aménagement de l'espace"", 'Sociologie']",[]
,hal-01533255,in,missing,Para una etnografia sensível da experiência urbana ordinária. Retornos sobre os bastidores de alguns trabalhos de campo colaborativos,ART,file,True,2021-06-10 08:30:09,http://creativecommons.org/licenses/by-nc-nd/,False,['0.shs'],"['1.shs.archi', '1.shs.socio']",[],2017,2017,Cadernos Proarq. Revista de arquitetura e urbanismo do Proarq,"1679-7604,2675-0392",Post-graduate Program in Architecture at FAU - Faculty of Architecture and Urbanism Universidade Federal do Rio de Janeiro,Articles dans une revue,,,,,False,,,,1.0,,doi_in_openapc,unknown,EUR,True,repository,"[""Sciences de l'Homme et de la Société""]","[""Architecture, aménagement de l'espace"", 'Sociologie']",[]
,hal-01535908,in,missing,Soundspaces,DOUV,file,True,2017-06-17 17:18:47,,True,"['0.scco', '0.sde', '0.shs', '0.spi']","['1.shs.archi', '1.shs.art', '1.shs.geo', '1.shs.scipo', '1.shs.socio']",[],2014-12,2014,,False,,Direction d'ouvrages,,,,,False,,,,5.0,,doi_in_openapc,unknown,EUR,True,repository,"['Autres', ""Sciences de l'environnement"", ""Sciences de l'Homme et de la Société"", ""Sciences de l'ingénieur""]","[""Architecture, aménagement de l'espace"", ""Art et histoire de l'art"", 'Géographie', 'Science politique', 'Sociologie']",[]
,hal-01535997,in,missing,Morphométrie des espaces urbains et expression d'un ressenti d'agrément : approche de la notion de bien-être par la quantification informationnelle du bassin de visibilité du piéton,COMM,notice,False,2017-06-09 19:38:13,,True,"['0.sde', '0.sdv']",[],[],2014-11-25,2014,,False,,Communications dans un congrès,,,,,False,,,,3.0,,doi_in_openapc,unknown,EUR,False,closed,"[""Sciences de l'environnement"", 'Autres']",[],[]
,hal-01536204,in,missing,EFFECTS OF DIFFUSE REFLECTION BY BUILDING FAÇADES ON THE SOUND PROPAGATION AND SOUNDSCAPES IN URBAN AREAS,COMM,file,True,2017-06-10 16:07:33,,True,"['0.spi', '0.scco', '0.shs']",['1.shs.archi'],[],2006-05-30,2006,,False,,Communications dans un congrès,,,,,False,,,,6.0,,doi_in_openapc,unknown,EUR,True,repository,"[""Sciences de l'ingénieur"", 'Autres', ""Sciences de l'Homme et de la Société""]","[""Architecture, aménagement de l'espace""]",[]
,hal-01541120,in,missing,Perceptive Evaluation Procedures for Diffuse Reflexion Listening,COMM,file,True,2017-06-17 17:56:27,,True,"['0.scco', '0.shs', '0.spi']",['1.shs.archi'],[],2006-09-11,2006,,False,,Communications dans un congrès,,,,,False,,,,4.0,,doi_in_openapc,unknown,EUR,True,repository,"['Autres', ""Sciences de l'Homme et de la Société"", ""Sciences de l'ingénieur""]","[""Architecture, aménagement de l'espace""]",[]
,hal-01542934,in,missing,Rigidité et souplesse de l'ordre de l'interaction chez Erving Goffman,ART,file,True,2017-06-20 11:55:48,http://creativecommons.org/licenses/by-nc-nd/,True,['0.shs'],"['1.shs.phil', '1.shs.socio']",[],2008,2008,Klesis - Revue philosophique,1954-3050,Klesis,Articles dans une revue,,,,,False,,,,1.0,,doi_in_openapc,unknown,EUR,True,repository,"[""Sciences de l'Homme et de la Société""]","['Philosophie', 'Sociologie']",[]
,hal-01545627,in,missing,"Un outil pour la résilience des paysages sonores ""low-fi"" des centre-villes, application à la qualification multi-sources de la commune de Bruz (35).",COMM,notice,False,2017-06-22 18:52:47,,True,"['0.stat', '0.spi', '0.shs']","['1.shs.envir', '1.shs.stat']",[],2014-05-22,2014,,False,,Communications dans un congrès,,,,,False,,,,2.0,,doi_in_openapc,unknown,EUR,False,closed,"['Informatique', ""Sciences de l'ingénieur"", ""Sciences de l'Homme et de la Société""]","['Autres', 'Autres']",[]
,hal-01545632,in,missing,ENVIRONNEMENT BATI ET MOBILITE PIETONNE ANALYSE MORPHOMETRIQUE DES ESPACES DE VISIBILITE ET CHOIX D'ITINERAIRES PEDESTRES,COMM,file,True,2017-06-22 19:20:20,,True,"['0.sde', '0.shs']","['1.shs.geo', '1.shs.stat']",[],2013-11,2013,,False,,Communications dans un congrès,,,,,False,,,,3.0,,doi_in_openapc,unknown,EUR,True,repository,"[""Sciences de l'environnement"", ""Sciences de l'Homme et de la Société""]","['Géographie', 'Autres']",[]
,hal-01552932,in,missing,Squaring the Circle,COUV,file,True,2017-07-03 12:24:49,,True,"['0.math', '0.spi']",[],[],2000,2000,,False,,Chapitres d'ouvrage,,,,,False,,,,1.0,,doi_in_openapc,unknown,EUR,True,repository,"['Autres', ""Sciences de l'ingénieur""]",[],[]
,hal-01555295,in,missing,Balcony form; An approach to reduce sound pressure level into the building façade,COUV,notice,False,2017-07-03 23:41:04,,True,"['0.spi', '0.shs', '0.phys']",['1.shs.archi'],[],2003,2003,,False,,Chapitres d'ouvrage,,,,,False,,,,2.0,,doi_in_openapc,unknown,EUR,False,closed,"[""Sciences de l'ingénieur"", ""Sciences de l'Homme et de la Société"", 'Autres']","[""Architecture, aménagement de l'espace""]",[]
,hal-01560019,in,missing,Frames of Visibility in Public Places,ART,file,True,2017-07-11 10:51:50,http://creativecommons.org/licenses/by-nc-nd/,False,['0.shs'],['1.shs.archi'],[],2001,2001,Places. A Forum of Environmental Design,0731-0455,Design history foundation,Articles dans une revue,,,,,False,,,,1.0,,doi_in_openapc,unknown,EUR,True,repository,"[""Sciences de l'Homme et de la Société""]","[""Architecture, aménagement de l'espace""]",[]
,hal-01560039,in,missing,L'ambiance comme expression de la vie urbaine,ART,file,True,2017-07-11 11:04:51,http://creativecommons.org/licenses/by-nc-nd/,False,['0.shs'],['1.shs.archi'],[],2004,2004,Cosmopolitiques. Cahiers théoriques pour l'écologie politique,False,Editions Apogée/Cosmopolitique,Articles dans une revue,,,,,False,,,,2.0,,doi_in_openapc,unknown,EUR,True,repository,"[""Sciences de l'Homme et de la Société""]","[""Architecture, aménagement de l'espace""]",[]
,hal-01560048,in,missing,De la qualité diffuse aux ambiances situées,ART,file,True,2017-07-11 11:11:31,http://creativecommons.org/licenses/by-nc-nd/,False,['0.shs'],['1.shs.socio'],[],2004,2004,Raisons Pratiques,1150-1367,EHESS,Articles dans une revue,,,,,False,,,,1.0,,doi_in_openapc,unknown,EUR,True,repository,"[""Sciences de l'Homme et de la Société""]",['Sociologie'],[]
,hal-01560105,in,missing,Silencing the city?,ART,file,True,2017-07-11 11:33:27,http://creativecommons.org/licenses/by-nc-nd/,False,['0.shs'],['1.shs.archi'],[],2013,2013,SoundEffects - An Interdisciplinary Journal of Sound and Sound Experience,1904-500X,,Articles dans une revue,,,,,False,,,,2.0,,doi_in_openapc,unknown,EUR,True,repository,"[""Sciences de l'Homme et de la Société""]","[""Architecture, aménagement de l'espace""]",[]
,hal-01560138,in,missing,Urban Ambiances as Common Ground ?,ART,file,True,2017-07-11 11:52:55,http://creativecommons.org/licenses/by-nc-nd/,False,['0.shs'],"['1.shs.archi', '1.shs.socio', '1.shs.phil']",[],2014,2014,Lebenswelt. aesthetics and philosophy of experience,"2240-9599,2240-9599",Università degli Studi di Milano,Articles dans une revue,,,,,False,,,,1.0,,doi_in_openapc,unknown,EUR,True,repository,"[""Sciences de l'Homme et de la Société""]","[""Architecture, aménagement de l'espace"", 'Sociologie', 'Philosophie']",[]
,hal-01560163,in,missing,Listening to urban sounds,ART,file,True,2017-07-11 11:59:44,http://creativecommons.org/licenses/by-nc-nd/,False,['0.shs'],['1.shs.archi'],[],2014,2014,Urbanistica,0042-1022,Istituto nazionale di urbanistica,Articles dans une revue,,,,,False,,,,1.0,,doi_in_openapc,unknown,EUR,True,repository,"[""Sciences de l'Homme et de la Société""]","[""Architecture, aménagement de l'espace""]",[]
,hal-01560172,in,missing,The backstage of urban ambiances,ART,file,True,2017-07-11 12:05:20,http://creativecommons.org/licenses/by-nc-nd/,False,['0.shs'],"['1.shs.archi', '1.shs.geo', '1.shs.psy']",[],2015,2015,"Emotion, Space and Society","1755-4586,1878-0040",Elsevier,Articles dans une revue,,,,,False,,,,1.0,,doi_in_openapc,unknown,EUR,True,repository,"[""Sciences de l'Homme et de la Société""]","[""Architecture, aménagement de l'espace"", 'Géographie', 'Autres']",[]
,hal-01561162,in,missing,Ambiance architecturale et urbaine,COUV,file,True,2017-07-12 14:16:21,http://creativecommons.org/licenses/by-nc-nd/,False,['0.shs'],['1.shs.archi'],[],2013,2013,,False,,Chapitres d'ouvrage,,,,,False,,,,1.0,,doi_in_openapc,unknown,EUR,True,repository,"[""Sciences de l'Homme et de la Société""]","[""Architecture, aménagement de l'espace""]",[]
,hal-01561242,in,missing,Projet urbain à Genève. Une image directrice pour un territoire en mutations.,COUV,file,True,2017-07-12 15:29:14,http://creativecommons.org/licenses/by-nc-nd/,False,['0.shs'],['1.shs.archi'],[],2001,2001,,False,,Chapitres d'ouvrage,,,,,False,,,,3.0,,doi_in_openapc,unknown,EUR,True,repository,"[""Sciences de l'Homme et de la Société""]","[""Architecture, aménagement de l'espace""]",[]
,hal-01561340,in,missing,Petit manifeste pour une métamorphose de la pédagogie du projet. Le projet en aménagement : formations et contextes,ART,file,True,2017-07-12 16:10:29,http://creativecommons.org/licenses/by-nc-nd/,False,['0.shs'],['1.shs.archi'],[],2001,2001,Trames - Revue de l'aménagement,0847-9119,Université de Montréal,Articles dans une revue,,,,,False,,,,1.0,,doi_in_openapc,unknown,EUR,True,repository,"[""Sciences de l'Homme et de la Société""]","[""Architecture, aménagement de l'espace""]",[]
,hal-01561360,in,missing,La logique du tiers à l'épreuve du projet urbain,COUV,file,True,2017-07-12 16:22:22,http://creativecommons.org/licenses/by-nc-nd/,False,['0.shs'],['1.shs.archi'],[],2001,2001,,False,,Chapitres d'ouvrage,,,,,False,,,,1.0,,doi_in_openapc,unknown,EUR,True,repository,"[""Sciences de l'Homme et de la Société""]","[""Architecture, aménagement de l'espace""]",[]
,hal-01561382,in,missing,"Mission Conseil à Lausanne, une expérience d'interprofessionalité en actes",COMM,file,True,2017-07-12 16:40:43,http://creativecommons.org/licenses/by-nc-nd/,False,['0.shs'],['1.shs.archi'],[],2000-09-28,2000,,False,,Communications dans un congrès,,,,,False,,,,1.0,,doi_in_openapc,unknown,EUR,True,repository,"[""Sciences de l'Homme et de la Société""]","[""Architecture, aménagement de l'espace""]",[]
,hal-01561405,in,missing,Le temps du paysage sonore,COMM,file,True,2017-07-12 16:54:37,http://creativecommons.org/licenses/by-nc-nd/,False,['0.shs'],['1.shs.archi'],[],2000-09-22,2000,,False,,Communications dans un congrès,,,,,False,,,,1.0,,doi_in_openapc,unknown,EUR,True,repository,"[""Sciences de l'Homme et de la Société""]","[""Architecture, aménagement de l'espace""]",[]
,hal-01561432,in,missing,Ambiance et Conception,COMM,file,True,2017-07-12 17:15:31,http://creativecommons.org/licenses/by-nc-nd/,False,['0.shs'],['1.shs.archi'],[],2002-03-15,2002,,False,,Communications dans un congrès,,,,,False,,,,1.0,,doi_in_openapc,unknown,EUR,True,repository,"[""Sciences de l'Homme et de la Société""]","[""Architecture, aménagement de l'espace""]",[]
,hal-01561455,in,missing,"La marguerite, le rhizome et le puzzle",ART,file,True,2017-07-12 17:35:31,http://creativecommons.org/licenses/by-nc-nd/,False,['0.shs'],['1.shs.archi'],[],2002,2002,Tracès - Bulletin technique de la Suisse romande,0251-0979,Espazium - Les éditions de la culture du bâti,Articles dans une revue,,,,,False,,,,1.0,,doi_in_openapc,unknown,EUR,True,repository,"[""Sciences de l'Homme et de la Société""]","[""Architecture, aménagement de l'espace""]",[]
,hal-01561579,in,missing,L'observation récurrente,COUV,file,True,2017-07-13 09:45:52,http://creativecommons.org/licenses/by-nc-nd/,False,['0.shs'],['1.shs.archi'],[],2001,2001,,False,,Chapitres d'ouvrage,,,,,False,,,,1.0,,doi_in_openapc,unknown,EUR,True,repository,"[""Sciences de l'Homme et de la Société""]","[""Architecture, aménagement de l'espace""]",[]
,hal-01561625,in,missing,Exposer l'architecture,ART,file,True,2017-07-13 10:42:02,http://creativecommons.org/licenses/by-nc-nd/,False,['0.shs'],['1.shs.archi'],[],2004,2004,"Faces, Journal d'architecture",0258-6800,Infolio éditions,Articles dans une revue,,,,,False,,,,1.0,,doi_in_openapc,unknown,EUR,True,repository,"[""Sciences de l'Homme et de la Société""]","[""Architecture, aménagement de l'espace""]",[]
,hal-01561723,in,missing,Ambiances urbaines et espaces publics,COUV,file,True,2017-07-13 11:35:06,http://creativecommons.org/licenses/by-nc-nd/,False,['0.shs'],['1.shs.archi'],[],2003,2003,,False,,Chapitres d'ouvrage,,,,,False,,,,1.0,,doi_in_openapc,unknown,EUR,True,repository,"[""Sciences de l'Homme et de la Société""]","[""Architecture, aménagement de l'espace""]",[]
,hal-01561759,in,missing,L'Identité sonore urbaine,COUV,file,True,2017-07-13 11:52:16,http://creativecommons.org/licenses/by-nc-nd/,False,['0.shs'],['1.shs.archi'],[],2003,2003,,False,,Chapitres d'ouvrage,,,,,False,,,,1.0,,doi_in_openapc,unknown,EUR,True,repository,"[""Sciences de l'Homme et de la Société""]","[""Architecture, aménagement de l'espace""]",[]
,hal-01561772,in,missing,"Polarité, Mixité, Intensité",COMM,file,True,2017-07-13 12:05:34,http://creativecommons.org/licenses/by-nc-nd/,False,['0.shs'],['1.shs.archi'],[],2003-03,2003,,False,,Communications dans un congrès,,,,,False,,,,1.0,,doi_in_openapc,unknown,EUR,True,repository,"[""Sciences de l'Homme et de la Société""]","[""Architecture, aménagement de l'espace""]",[]
,hal-01561784,in,missing,Le renouvellement urbain en marche,ART,file,True,2017-07-13 12:19:22,http://creativecommons.org/licenses/by-nc-nd/,False,['0.shs'],['1.shs.archi'],[],2004,2004,Les Annales de la Recherche Urbaine,0180-930X,PUCA,Articles dans une revue,,,,,False,,,,1.0,,doi_in_openapc,unknown,EUR,True,repository,"[""Sciences de l'Homme et de la Société""]","[""Architecture, aménagement de l'espace""]",[]
,hal-01561799,in,missing,Horizons pour une recherche impliquée,COUV,file,True,2017-07-13 12:35:42,http://creativecommons.org/licenses/by-nc-nd/,False,['0.shs'],['1.shs.archi'],[],2004,2004,,False,,Chapitres d'ouvrage,,,,,False,,,,1.0,,doi_in_openapc,unknown,EUR,True,repository,"[""Sciences de l'Homme et de la Société""]","[""Architecture, aménagement de l'espace""]",[]
