doi,halId,hal_coverage,upw_coverage,title,hal_docType,hal_location,hal_openAccess_bool,hal_submittedDate,hal_licence,hal_selfArchiving,hal_domain,hal_shsdomain,hal_infodomain,published_date,published_year,journal_name,journal_issns,publisher,genre,journal_issn_l,oa_status,upw_location,version,suspicious_journal,licence,journal_is_in_doaj,journal_is_oa,author_count,is_paratext,apc_tracking,apc_amount,apc_currency,is_oa,oa_type,scientific_field,shs_field,info_field
,hal-02877854,in,missing,"Lectures de Marie-Paule Halgand : « REM », Jean-Louis Violeau, Editions B2, 2014, 106 p. ; « REM CLOG », Kyle May, rédacteur en chef, 184 p.",ART,file,True,2020-06-22 17:15:01,http://creativecommons.org/licenses/by-nc-nd/,False,['0.shs'],['1.shs.archi'],[],2015,2015,Lieux Communs - Les Cahiers du LAUA,1779-5885,"LAUA (Langages, Actions Urbaines, Altérités - Ecole Nationale Supérieure d'Architecture de Nantes)",Articles dans une revue,,,,,False,,,,1.0,,doi_in_openapc,unknown,EUR,True,repository,"[""Sciences de l'Homme et de la Société""]","[""Architecture, aménagement de l'espace""]",[]
,hal-02877869,in,missing,"Arnaud Théval, ""Invisibles 2007-2013. Journal de l’œuvre"", Ed Dilecta, Paris, 128 p. : Lecture de Laurent Devisme",ART,file,True,2020-06-22 17:28:05,http://creativecommons.org/licenses/by-nc-nd/,False,['0.shs'],['1.shs.archi'],[],2015,2015,Lieux Communs - Les Cahiers du LAUA,1779-5885,"LAUA (Langages, Actions Urbaines, Altérités - Ecole Nationale Supérieure d'Architecture de Nantes)",Articles dans une revue,,,,,False,,,,1.0,,doi_in_openapc,unknown,EUR,True,repository,"[""Sciences de l'Homme et de la Société""]","[""Architecture, aménagement de l'espace""]",[]
,hal-02877881,in,missing,"Lecture de Frédéric Barbe : Fabrication et usage des écoquartiers, essai critique sur la généralisation de l'aménagement durable en France de Vincent Renault, Lausanne, Presse polytechniques et universitaires romandes, collection « Espace en société », 2014, 122 p.",ART,file,True,2020-06-22 17:40:20,http://creativecommons.org/licenses/by-nc-nd/,False,['0.shs'],['1.shs.archi'],[],2015,2015,Lieux Communs - Les Cahiers du LAUA,1779-5885,"LAUA (Langages, Actions Urbaines, Altérités - Ecole Nationale Supérieure d'Architecture de Nantes)",Articles dans une revue,,,,,False,,,,1.0,,doi_in_openapc,unknown,EUR,True,repository,"[""Sciences de l'Homme et de la Société""]","[""Architecture, aménagement de l'espace""]",[]
,hal-02883354,in,missing,"Le scénographe, une figure émergente de La ville événementielle",ART,file,True,2020-06-29 09:32:05,http://creativecommons.org/licenses/by-nc-nd/,False,['0.shs'],['1.shs.archi'],[],2015,2015,Lieux Communs - Les Cahiers du LAUA,1779-5885,"LAUA (Langages, Actions Urbaines, Altérités - Ecole Nationale Supérieure d'Architecture de Nantes)",Articles dans une revue,,,,,False,,,,1.0,,doi_in_openapc,unknown,EUR,True,repository,"[""Sciences de l'Homme et de la Société""]","[""Architecture, aménagement de l'espace""]",[]
,hal-02886073,in,missing,Vers une grammaire narrative à 360° : Ou comment la construction d’un décor réel vient dynamiser les questionnements théoriques,ART,file,True,2020-07-01 11:20:40,http://creativecommons.org/licenses/by-nc-nd/,True,['0.shs'],"['1.shs.archi', '1.shs.art']",[],2020-07-01,2020,Entrelacs,"1266-7188,2261-5482",École nationale supérieure d'audiovisuel (Toulouse) ; Téraèdre,Articles dans une revue,,,,,False,,,,1.0,,doi_in_openapc,unknown,EUR,True,repository,"[""Sciences de l'Homme et de la Société""]","[""Architecture, aménagement de l'espace"", ""Art et histoire de l'art""]",[]
,hal-02940691,in,missing,CoolParks : aide à la conception de parcs et de formes urbaines pour optimiser le rafraîchissement urbain,COMM,file,True,2021-08-11 11:30:01,http://creativecommons.org/licenses/by-nc-nd/,True,"['0.sde', '0.sdu', '0.spi']",[],[],2020-07-01,2020,,False,,Communications dans un congrès,,,,,False,,,,6.0,,doi_in_openapc,unknown,EUR,True,repository,"[""Sciences de l'environnement"", 'Autres', ""Sciences de l'ingénieur""]",[],[]
,hal-02943631,in,missing,Designing Intradiegetic and Extradiegetic Spaces for Virtual Reality,COMM,file,True,2020-09-20 10:47:57,http://creativecommons.org/licenses/by-nc-nd/,True,['0.shs'],['1.shs.archi'],[],2020-09-16,2020,,False,,Communications dans un congrès,,,,,False,,,,2.0,,doi_in_openapc,unknown,EUR,True,repository,"[""Sciences de l'Homme et de la Société""]","[""Architecture, aménagement de l'espace""]",[]
,hal-02962796,in,missing,Da cidade pacífica à asseptização das atmosferas urbanas: modulações do sensorium humano,COUV,file,True,2020-10-16 12:00:12,http://creativecommons.org/licenses/by-nc-nd/,True,['0.shs'],"['1.shs.socio', '1.shs.archi']",[],2020-08,2020,,False,,Chapitres d'ouvrage,,,,,False,,,,1.0,,doi_in_openapc,unknown,EUR,True,repository,"[""Sciences de l'Homme et de la Société""]","['Sociologie', ""Architecture, aménagement de l'espace""]",[]
,hal-02969607,in,missing,"Le jeune chercheur et son hybridité au-delà de la CIFRE : savoirs, espaces et professionnels de la recherche urbaine en question",COMM,notice,False,2020-10-16 17:01:34,,True,['0.shs'],"['1.shs.archi', '1.shs.socio', '1.shs.scipo', '1.shs.anthro-se']",[],2020-09-21,2020,,False,,Communications dans un congrès,,,,,False,,,,3.0,,doi_in_openapc,unknown,EUR,False,closed,"[""Sciences de l'Homme et de la Société""]","[""Architecture, aménagement de l'espace"", 'Sociologie', 'Science politique', 'Anthropo']",[]
,hal-02973272,in,missing,Un Ricardou édifiant,COUV,file,True,2020-10-21 07:55:55,,True,"['0.shs', '0.sde']","['1.shs.archi', '1.shs.art']",[],2020-10-20,2020,,False,,Chapitres d'ouvrage,,,,,False,,,,1.0,,doi_in_openapc,unknown,EUR,True,repository,"[""Sciences de l'Homme et de la Société"", ""Sciences de l'environnement""]","[""Architecture, aménagement de l'espace"", ""Art et histoire de l'art""]",[]
,hal-02975677,in,missing,"ARCHITECTURE 68. Panorama international sur des renouveaux pédagogiques, Genève, MétisPresses",DOUV,notice,False,2020-10-22 21:25:28,,True,['0.shs'],['1.shs.archi'],[],2020,2020,,False,,Direction d'ouvrages,,,,,False,,,,4.0,,doi_in_openapc,unknown,EUR,False,closed,"[""Sciences de l'Homme et de la Société""]","[""Architecture, aménagement de l'espace""]",[]
,hal-02985293,in,missing,Embedded Aesthetics. An Empirical Approach to Everyday Aesthetic Relations to the Environment and its Application to Urban Spaces,COUV,notice,False,2020-11-02 09:48:48,,True,['0.shs'],[],[],2020,2020,,False,,Chapitres d'ouvrage,,,,,False,,,,1.0,,doi_in_openapc,unknown,EUR,False,closed,"[""Sciences de l'Homme et de la Société""]",[],[]
,hal-02985305,in,missing,Zum Umgang mit Atmosphären. Atmosphäre als Handlungsressource und sinnliche Vermittlerin von Lebensmöglichen,COUV,notice,False,2020-11-02 09:57:11,,True,['0.shs'],[],[],2020,2020,,False,,Chapitres d'ouvrage,,,,,False,,,,1.0,,doi_in_openapc,unknown,EUR,False,closed,"[""Sciences de l'Homme et de la Société""]",[],[]
,hal-02991958,in,missing,"Public lighting and participatory democracy, the contribution of public transport drivers in Nantes Métropole to the evaluation of nocturnal urban ambiances",COMM,file,True,2020-11-06 11:06:24,http://creativecommons.org/licenses/by-nc-nd/,True,['0.shs'],['1.shs.archi'],[],2020,2020,Natures Sciences Sociétés,"1240-1307,1765-2979",EDP Sciences,Communications dans un congrès,,,,,False,,,,3.0,,doi_in_openapc,unknown,EUR,True,repository,"[""Sciences de l'Homme et de la Société""]","[""Architecture, aménagement de l'espace""]",[]
,hal-02998784,in,missing,Sonic Affordances of a Sacred Spring. The Urban Courtyard as a Figure of Rehabilitation of the Medina,ART,file,True,2021-02-23 11:41:44,http://creativecommons.org/licenses/by-sa/,False,['0.shs'],['1.shs.archi'],[],2020-11-10,2020,Journal of Sonic Studies,2212-6252,Leiden University Press (LUP),Articles dans une revue,,,,,False,,,,1.0,,doi_in_openapc,unknown,EUR,True,repository,"[""Sciences de l'Homme et de la Société""]","[""Architecture, aménagement de l'espace""]",[]
,hal-03023816,in,missing,Quel devenir de la sensibilité contemporaine ?,COUV,notice,False,2020-11-25 15:21:14,,True,['0.shs'],"['1.shs.anthro-se', '1.shs.archi', '1.shs.socio']",[],2021-06,2021,,False,,Chapitres d'ouvrage,,,,,False,,,,1.0,,doi_in_openapc,unknown,EUR,False,closed,"[""Sciences de l'Homme et de la Société""]","['Anthropo', ""Architecture, aménagement de l'espace"", 'Sociologie']",[]
,hal-03053936,in,missing,DIAGPART. Des postures et pratiques de groupes professionnels au diagnostic pluriel du paysage sonore urbain,COMM,notice,False,2020-12-11 11:30:29,,False,"['0.sde', '0.shs']",['1.shs.archi'],[],2017-11-27,2017,,False,,Communications dans un congrès,,,,,False,,,,2.0,,doi_in_openapc,unknown,EUR,False,closed,"[""Sciences de l'environnement"", ""Sciences de l'Homme et de la Société""]","[""Architecture, aménagement de l'espace""]",[]
,hal-03068405,in,missing,Virtual Avatars as Children Companions : For a VR-based Educational Platform: How Should They Look Like?,COMM,file,True,2020-12-15 16:08:03,http://creativecommons.org/licenses/by-nc-nd/,True,['0.info'],[],['1.info.info-gr'],2020-12-02,2020,,False,,Communications dans un congrès,,,,,False,,,,4.0,,doi_in_openapc,unknown,EUR,True,repository,['Informatique'],[],"[""Synthèse d'image et réalité virtuelle""]"
,hal-03080129,in,missing,"Penser hors les cadres. La recherche (sur, par et avec le) sensible comme ouverture pour des professionnalités de l’«entre deux» »",COUV,notice,False,2020-12-17 15:18:14,,False,['0.shs'],['1.shs.archi'],[],2021,2021,,False,,Chapitres d'ouvrage,,,,,False,,,,2.0,,doi_in_openapc,unknown,EUR,False,closed,"[""Sciences de l'Homme et de la Société""]","[""Architecture, aménagement de l'espace""]",[]
,hal-03087204,in,missing,Italophilie et autres tropismes : l’école « à la nantaise »,COMM,notice,False,2020-12-23 15:01:17,,False,['0.shs'],['1.shs.archi'],[],2018,2018,,False,,Communications dans un congrès,,,,,False,,,,1.0,,doi_in_openapc,unknown,EUR,False,closed,"[""Sciences de l'Homme et de la Société""]","[""Architecture, aménagement de l'espace""]",[]
,hal-03091638,in,missing,Introduction au séminaire n° 3 Nantes / Rennes- HEnsA20,COMM,notice,False,2020-12-31 12:12:25,,False,['0.shs'],['1.shs.archi'],[],2018,2018,,False,,Communications dans un congrès,,,,,False,,,,1.0,,doi_in_openapc,unknown,EUR,False,closed,"[""Sciences de l'Homme et de la Société""]","[""Architecture, aménagement de l'espace""]",[]
,hal-03091648,in,missing,"La constitution d’un corps enseignant diversifié, de l’unité pédagogique à l’école d’architecture de Nantes",COMM,notice,False,2020-12-31 12:21:31,,False,['0.shs'],['1.shs.archi'],[],2018,2018,,False,,Communications dans un congrès,,,,,False,,,,1.0,,doi_in_openapc,unknown,EUR,False,closed,"[""Sciences de l'Homme et de la Société""]","[""Architecture, aménagement de l'espace""]",[]
,hal-03091657,in,missing,L’école régionale d’architecture de Nantes : un projet de cité des arts dans les années 1960,COMM,notice,False,2020-12-31 12:33:24,,False,['0.shs'],['1.shs.archi'],[],2018,2018,,False,,Communications dans un congrès,,,,,False,,,,1.0,,doi_in_openapc,unknown,EUR,False,closed,"[""Sciences de l'Homme et de la Société""]","[""Architecture, aménagement de l'espace""]",[]
,hal-03093808,in,missing,Beiträge einer situativen Alltagsästhetik zur Diskussion über die schöne Stadt,COUV,notice,False,2021-01-04 10:05:45,,True,['0.shs'],"['1.shs.geo', '1.shs.archi']",[],2020,2020,,False,,Chapitres d'ouvrage,,,,,False,,,,1.0,,doi_in_openapc,unknown,EUR,False,closed,"[""Sciences de l'Homme et de la Société""]","['Géographie', ""Architecture, aménagement de l'espace""]",[]
,hal-03109498,in,missing,"Urbanités, entre liberté et sécurité",COUV,file,True,2021-01-13 18:27:08,http://creativecommons.org/licenses/by-nc-nd/,True,['0.shs'],['1.shs.archi'],[],2020,2020,,False,,Chapitres d'ouvrage,,,,,False,,,,1.0,,doi_in_openapc,unknown,EUR,True,repository,"[""Sciences de l'Homme et de la Société""]","[""Architecture, aménagement de l'espace""]",[]
,hal-03109540,in,missing,Le réseau Ramau comme forme spécifique d'organisation du travail scientifique,COUV,file,True,2021-01-13 18:56:42,http://creativecommons.org/licenses/by-nc-nd/,True,['0.shs'],['1.shs.archi'],[],2019,2019,,False,,Chapitres d'ouvrage,,,,,False,,,,1.0,,doi_in_openapc,unknown,EUR,True,repository,"[""Sciences de l'Homme et de la Société""]","[""Architecture, aménagement de l'espace""]",[]
,hal-03114118,in,missing,Les lisières urbaines : lieux de reliance urbaine et sensible,COMM,file,True,2021-01-18 17:32:56,,False,['0.shs'],['1.shs.archi'],[],2020,2020,,False,,Communications dans un congrès,,,,,False,,,,2.0,,doi_in_openapc,unknown,EUR,True,repository,"[""Sciences de l'Homme et de la Société""]","[""Architecture, aménagement de l'espace""]",[]
,hal-03118451,in,missing,Immersions quotidiennes de Brest à Québec,COUV,notice,False,2021-01-22 11:31:11,,True,['0.shs'],['1.shs.archi'],[],2021-01-05,2021,,False,,Chapitres d'ouvrage,,,,,False,,,,1.0,,doi_in_openapc,unknown,EUR,False,closed,"[""Sciences de l'Homme et de la Société""]","[""Architecture, aménagement de l'espace""]",[]
,hal-03121591,in,missing,Review of Visualizing Historical Architectural Knowledge through Virtual Reality,COMM,file,True,2021-01-26 14:55:49,http://creativecommons.org/licenses/by-nc-nd/,True,['0.shs'],['1.shs.archi'],[],2021-03-27,2021,,False,,Communications dans un congrès,,,,,False,,,,5.0,,doi_in_openapc,unknown,EUR,True,repository,"[""Sciences de l'Homme et de la Société""]","[""Architecture, aménagement de l'espace""]",[]
,hal-03136469,in,missing,"Ambiances, Alloæsthesia: Senses, Inventions, Worlds",DOUV,file,True,2021-02-23 08:35:12,,False,['0.shs'],['1.shs.archi'],[],2020,2020,,False,,Direction d'ouvrages,,,,,False,,,,1.0,,doi_in_openapc,unknown,EUR,True,repository,"[""Sciences de l'Homme et de la Société""]","[""Architecture, aménagement de l'espace""]",[]
,hal-03142025,in,missing,"Filmer les collections, déjouer les régimes de visibilité",ART,file,True,2021-02-15 16:49:51,http://creativecommons.org/licenses/by-nc-nd/,False,['0.shs'],"['1.shs.museo', '1.shs.art']",[],2020-11,2020,Trouble dans les collections,2778-2913,Musée Théodore Monod de l'IFAN (Dakar),Articles dans une revue,,,,,False,,,,1.0,,doi_in_openapc,unknown,EUR,True,repository,"[""Sciences de l'Homme et de la Société""]","['Héritage culturel et muséologie', ""Art et histoire de l'art""]",[]
,hal-03156481,in,missing,"Fertilités. Sur les chemins de collecte des femmes oasiennes (univers végétal, résonateurs cosmiques, soins collectifs)",ART,file,True,2021-06-22 11:27:09,http://creativecommons.org/licenses/by-nc-nd/,True,['0.shs'],"['1.shs.archi', '1.shs.anthro-se', '1.shs.socio']",[],2020,2020,Anthropologie et sociétés,"1703-7921,0702-8997","Québec : Département d'anthropologie, Faculté des sciences sociales, Université Laval",Articles dans une revue,,,,,False,,,,1.0,,doi_in_openapc,unknown,EUR,True,repository,"[""Sciences de l'Homme et de la Société""]","[""Architecture, aménagement de l'espace"", 'Anthropo', 'Sociologie']",[]
,hal-03156551,in,missing,"Lisbonne, 21e siècle. Vers un nouvel espace référentiel du centre urbain : emprise marchande, aménagement certifié, libéralisme multiculturel",ART,file,True,2021-06-22 13:42:16,,True,['0.shs'],"['1.shs.archi', '1.shs.anthro-se', '1.shs.socio']",[],2019,2019,EspacesTemps.net,1777-5477,Association Espaces Temps.net,Articles dans une revue,,,,,False,,,,1.0,,doi_in_openapc,unknown,EUR,True,repository,"[""Sciences de l'Homme et de la Société""]","[""Architecture, aménagement de l'espace"", 'Anthropo', 'Sociologie']",[]
,hal-03156566,in,missing,L’affadissement des villes méditerranéennes et la désacralisation de la figure de l’hôte,ART,file,True,2021-06-22 13:41:42,http://creativecommons.org/licenses/by-nd/,True,['0.shs'],"['1.shs.archi', '1.shs.anthro-se', '1.shs.socio']",[],2018,2018,SociologieS,1992-2655,Toulouse : Association internationale des sociologues de langue française,Articles dans une revue,,,,,False,,,,1.0,,doi_in_openapc,unknown,EUR,True,repository,"[""Sciences de l'Homme et de la Société""]","[""Architecture, aménagement de l'espace"", 'Anthropo', 'Sociologie']",[]
,hal-03169583,in,missing,"Track the cities. [issue editor, N°40 La Furia Umana Journal]",DOUV,notice,False,2021-03-15 14:31:11,,False,['0.shs'],"['1.shs.archi', '1.shs.art']",[],2021-03,2021,La Furia Umana,2255-2812,Duen de Bux,Direction d'ouvrages,,,,,False,,,,3.0,,doi_in_openapc,unknown,EUR,False,closed,"[""Sciences de l'Homme et de la Société""]","[""Architecture, aménagement de l'espace"", ""Art et histoire de l'art""]",[]
,hal-03169668,in,missing,Symphonies urbaines à rebours,ART,file,True,2021-03-15 15:09:00,,False,['0.shs'],"['1.shs.archi', '1.shs.art']",[],2021-03,2021,La Furia Umana,2255-2812,Duen de Bux,Articles dans une revue,,,,,False,,,,3.0,,doi_in_openapc,unknown,EUR,True,repository,"[""Sciences de l'Homme et de la Société""]","[""Architecture, aménagement de l'espace"", ""Art et histoire de l'art""]",[]
,hal-03174902,in,missing,Les mises en ambiance de la ville apaisée. Paradoxes et risques d'une aseptisation programmée,ART,file,True,2021-07-19 17:56:07,,True,['0.shs'],"['1.shs.socio', '1.shs.archi']",[],2020,2020,Géo-Regards,False,Editions Alphil Presses universitaires suisses,Articles dans une revue,,,,,False,,,,1.0,,doi_in_openapc,unknown,EUR,True,repository,"[""Sciences de l'Homme et de la Société""]","['Sociologie', ""Architecture, aménagement de l'espace""]",[]
,hal-03178858,in,missing,La ville en mode « démonstrateur urbain » : learning from Nantes City Lab,ART,file,True,2021-03-24 09:34:21,,True,['0.shs'],"['1.shs.archi', '1.shs.socio']",[],2020,2020,Revue Internationale d’Urbanisme,False,APERAU,Articles dans une revue,,,,,False,,,,2.0,,doi_in_openapc,unknown,EUR,True,repository,"[""Sciences de l'Homme et de la Société""]","[""Architecture, aménagement de l'espace"", 'Sociologie']",[]
,hal-03197707,in,missing,La métropole relationnelle en train de se faire : débattre des politiques de mobilités dans la ville diffuse (le cas du Pays de Brest),COMM,notice,False,2021-04-14 10:07:52,,True,['0.shs'],['1.shs.archi'],[],2021-04-13,2021,,False,,Communications dans un congrès,,,,,False,,,,2.0,,doi_in_openapc,unknown,EUR,False,closed,"[""Sciences de l'Homme et de la Société""]","[""Architecture, aménagement de l'espace""]",[]
,hal-03197710,in,missing,Des circulations automobiles pérennes dans les métropoles intermédiaires ? Nécessité et désir d'automobile dans le pays de Brest,COUV,notice,False,2021-04-14 10:10:00,,True,['0.shs'],['1.shs.archi'],[],2021-04,2021,,False,,Chapitres d'ouvrage,,,,,False,,,,2.0,,doi_in_openapc,unknown,EUR,False,closed,"[""Sciences de l'Homme et de la Société""]","[""Architecture, aménagement de l'espace""]",[]
,hal-03197714,in,missing,"De la condition habitante à la vision administrative du pays de Brest. Un décalage entre les territoires administratif et vécu, pratiqué, habité ?",COUV,notice,False,2021-04-14 10:11:16,,True,['0.shs'],['1.shs.archi'],[],2020,2020,,False,,Chapitres d'ouvrage,,,,,False,,,,1.0,,doi_in_openapc,unknown,EUR,False,closed,"[""Sciences de l'Homme et de la Société""]","[""Architecture, aménagement de l'espace""]",[]
,hal-03205491,in,missing,Institution universitaire et mouvements étudiants ? Entre intégration et rupture,DOUV,notice,False,2021-04-22 12:45:38,,False,['0.shs'],"['1.shs.hist', '1.shs.scipo', '1.shs.socio']",[],2020-06,2020,,False,,Direction d'ouvrages,,,,,False,,,,2.0,,doi_in_openapc,unknown,EUR,False,closed,"[""Sciences de l'Homme et de la Société""]","['Autres', 'Science politique', 'Sociologie']",[]
,hal-03220253,in,missing,Artificial Lighting and Darkness in the Architectural and Urban Practices. Session 2 – Introduction,COMM,notice,False,2021-05-25 09:36:00,,False,['0.shs'],['1.shs.archi'],[],2020,2020,,False,,Communications dans un congrès,,,,,False,,,,1.0,,doi_in_openapc,unknown,EUR,False,closed,"[""Sciences de l'Homme et de la Société""]","[""Architecture, aménagement de l'espace""]",[]
,hal-03227817,in,missing,Représenter les temporalités urbaines : outils et méthodes pour saisir les phénomènes de vacances commerciales,COMM,notice,False,2021-05-17 16:08:14,,True,['0.shs'],['1.shs.archi'],[],2017-03-09,2017,,False,,Communications dans un congrès,,,,,False,,,,2.0,,doi_in_openapc,unknown,EUR,False,closed,"[""Sciences de l'Homme et de la Société""]","[""Architecture, aménagement de l'espace""]",[]
,hal-03227828,in,missing,Les ambiances commerciales mises à l’épreuve du piéton,COMM,notice,False,2021-05-17 16:11:38,,True,['0.shs'],['1.shs.archi'],[],2016-07-11,2016,,False,,Communications dans un congrès,,,,,False,,,,1.0,,doi_in_openapc,unknown,EUR,False,closed,"[""Sciences de l'Homme et de la Société""]","[""Architecture, aménagement de l'espace""]",[]
,hal-03227833,in,missing,L’architecture commerciale à l’usage des villes,COMM,notice,False,2021-05-17 16:15:08,,True,['0.shs'],['1.shs.archi'],[],2015-11-28,2015,,False,,Communications dans un congrès,,,,,False,,,,1.0,,doi_in_openapc,unknown,EUR,False,closed,"[""Sciences de l'Homme et de la Société""]","[""Architecture, aménagement de l'espace""]",[]
,hal-03227838,in,missing,Comment sonne le monde ?,COMM,notice,False,2021-05-17 16:18:29,,True,['0.shs'],['1.shs.archi'],[],2013-10-04,2013,,False,,Communications dans un congrès,,,,,False,,,,1.0,,doi_in_openapc,unknown,EUR,False,closed,"[""Sciences de l'Homme et de la Société""]","[""Architecture, aménagement de l'espace""]",[]
,hal-03227839,in,missing,Résiliences commerciales,COMM,notice,False,2021-05-17 16:19:45,,True,['0.shs'],['1.shs.archi'],[],2013-03-21,2013,,False,,Communications dans un congrès,,,,,False,,,,1.0,,doi_in_openapc,unknown,EUR,False,closed,"[""Sciences de l'Homme et de la Société""]","[""Architecture, aménagement de l'espace""]",[]
,hal-03227842,in,missing,Explorations urbaines sur internet,COMM,notice,False,2021-05-17 16:21:26,,True,['0.shs'],['1.shs.archi'],[],2012-11-16,2012,,False,,Communications dans un congrès,,,,,False,,,,1.0,,doi_in_openapc,unknown,EUR,False,closed,"[""Sciences de l'Homme et de la Société""]","[""Architecture, aménagement de l'espace""]",[]
,hal-03239002,in,missing,Retour d’enquête ethnographique sur l’appropriation par le public local des lieux de mémoire consacrés à la traite négrière,COMM,notice,False,2021-05-27 12:38:41,,True,['0.shs'],"['1.shs.socio', '1.shs.anthro-se', '1.shs.archi']",[],2018-12-06,2018,,False,,Communications dans un congrès,,,,,False,,,,1.0,,doi_in_openapc,unknown,EUR,False,closed,"[""Sciences de l'Homme et de la Société""]","['Sociologie', 'Anthropo', ""Architecture, aménagement de l'espace""]",[]
,hal-03241005,in,missing,Les sociabilités dans le Pays de Brest,COMM,notice,False,2021-05-28 13:56:27,,True,['0.shs'],['1.shs.archi'],[],2018-01-22,2018,,False,,Communications dans un congrès,,,,,False,,,,1.0,,doi_in_openapc,unknown,EUR,False,closed,"[""Sciences de l'Homme et de la Société""]","[""Architecture, aménagement de l'espace""]",[]
,hal-03244140,in,missing,Crossing Professional Habits for Global Analysis of Urban Soundscapes,COMM,notice,False,2021-06-01 09:30:20,,False,['0.shs'],['1.shs.archi'],[],2019-04-03,2019,,False,,Communications dans un congrès,,,,,False,,,,6.0,,doi_in_openapc,unknown,EUR,False,closed,"[""Sciences de l'Homme et de la Société""]","[""Architecture, aménagement de l'espace""]",[]
,hal-03244162,in,missing,L’appréhension du paysage via les ateliers promenades : Vers une conception urbaine plus sensible,COMM,notice,False,2021-06-01 09:42:51,,False,['0.shs'],['1.shs.archi'],[],2017-10-25,2017,,False,,Communications dans un congrès,,,,,False,,,,2.0,,doi_in_openapc,unknown,EUR,False,closed,"[""Sciences de l'Homme et de la Société""]","[""Architecture, aménagement de l'espace""]",[]
,hal-03244327,in,missing,Understanding sensory experiences from and for urban design,COMM,notice,False,2021-06-01 10:49:28,,False,['0.shs'],['1.shs.archi'],[],2018-11-16,2018,,False,,Communications dans un congrès,,,,,False,,,,1.0,,doi_in_openapc,unknown,EUR,False,closed,"[""Sciences de l'Homme et de la Société""]","[""Architecture, aménagement de l'espace""]",[]
,hal-03244350,in,missing,"Enquêter « LUCIE AUBRAC ». Questions interdisciplinaires, pédagogiques et politiques",COMM,notice,False,2021-06-01 10:56:31,,False,['0.shs'],['1.shs.archi'],[],2018-05-25,2018,,False,,Communications dans un congrès,,,,,False,,,,2.0,,doi_in_openapc,unknown,EUR,False,closed,"[""Sciences de l'Homme et de la Société""]","[""Architecture, aménagement de l'espace""]",[]
,hal-03244367,in,missing,"Paysage (multi)sensoriel en recherches urbaines. Trajectoires, fondements, enjeux",COMM,notice,False,2021-06-01 11:01:00,,False,['0.shs'],['1.shs.archi'],[],2017-10-12,2017,,False,,Communications dans un congrès,,,,,False,,,,1.0,,doi_in_openapc,unknown,EUR,False,closed,"[""Sciences de l'Homme et de la Société""]","[""Architecture, aménagement de l'espace""]",[]
,hal-03244547,in,missing,Listening to atmospheres,COUV,file,True,2021-06-01 11:58:48,http://creativecommons.org/licenses/by-nc-nd/,False,['0.shs'],['1.shs.archi'],[],2016,2016,,False,,Chapitres d'ouvrage,,,,,False,,,,1.0,,doi_in_openapc,unknown,EUR,True,repository,"[""Sciences de l'Homme et de la Société""]","[""Architecture, aménagement de l'espace""]",[]
